"id","url","score","title","summary","venue","year","authors","citationCount","referenceCount","influentialCitationCount"
"9160673f89ecb326db8c64f8d09ab30f35a74e9d","https://www.semanticscholar.org/paper/9160673f89ecb326db8c64f8d09ab30f35a74e9d",3,"Arithmetic with Language Models: from Memorization to Computation","The findings support the hypothesis that the language model works as an Encoding-Regression-Decoding machine where the computation takes place in the value space once the input token representation is mapped to an appropriate internal representation.","arXiv.org",2023,"D. Maltoni,M. Ferrara",0,27,0
"dd69049674f41d4ef5314b8f95bacfe59de31376","https://www.semanticscholar.org/paper/dd69049674f41d4ef5314b8f95bacfe59de31376",2,"Conditions for Length Generalization in Learning Reasoning Skills","This work identifies and proves conditions that decide whether the length generalization problem can be solved or not for a reasoning task in a particular representation.","arXiv.org",2023,"Changnan Xiao,Bing Liu",2,68,0
"49c45d2a2773c537804c38d69cde67e00fbad6fe","https://www.semanticscholar.org/paper/49c45d2a2773c537804c38d69cde67e00fbad6fe",2,"Tokenization counts: the impact of tokenization on arithmetic in frontier LLMs","This work performs the first study of how number tokenization choices lead to differences in model performance on arithmetic tasks, accompanied by a thorough analysis of error patterns.","",2024,"Aaditya K. Singh,DJ Strouse",0,40,0
"817e52b815560f95171d8fa60f78dd965e885a65","https://www.semanticscholar.org/paper/817e52b815560f95171d8fa60f78dd965e885a65",2,"How well do Large Language Models perform in Arithmetic tasks?","This work proposes an arithmetic dataset MATH 401 to test the latest large language models including GPT-4, ChatG PT, InstrctGPT, Galactica, and LLaMA with various arithmetic expressions and provides a detailed analysis of the ability of largelanguage models.","arXiv.org",2023,"Zheng Yuan,Hongyi Yuan,Chuanqi Tan,Wei Wang,Songfang Huang",52,35,3
"8c7846c9805834dbe2fb0c8f48253b8d65b79d6a","https://www.semanticscholar.org/paper/8c7846c9805834dbe2fb0c8f48253b8d65b79d6a",2,"Goat: Fine-tuned LLaMA Outperforms GPT-4 on Arithmetic Tasks","Goat, a fine-tuned LLaMA model that significantly outperforms GPT-4 on a range of arithmetic tasks, is introduced and an approach that classifies tasks based on their learnability, and subsequently decomposes unlearnable tasks into a series of learnable tasks by leveraging basic arithmetic principles is proposed.","arXiv.org",2023,"Tiedong Liu,K. H. Low",34,40,3
"ee7b871213e1deafadea4b7752467b5c5ab1b9fb","https://www.semanticscholar.org/paper/ee7b871213e1deafadea4b7752467b5c5ab1b9fb",2,"GPT Can Solve Mathematical Problems Without a Calculator","The MathGLM, fine-tuned from GLM-10B on a dataset with additional multi-step arithmetic operations and math problems described in text, achieves similar performance to GPT-4 on a 5,000-samples Chinese math problem test set.","arXiv.org",2023,"Z. Yang,Ming Ding,Qingsong Lv,Zhihuan Jiang,Zehai He,Yuyi Guo,Jinfeng Bai,Jie Tang",16,45,0
"b1fe7bdcfef4e12febe7e8bed8826e66689d60ed","https://www.semanticscholar.org/paper/b1fe7bdcfef4e12febe7e8bed8826e66689d60ed",2,"Auto-Regressive Next-Token Predictors are Universal Learners","This work presents a theoretical framework for studying auto-regressive next-token predictors, and introduces a new complexity measure -- length complexity -- which measures the number of intermediate tokens in a CoT sequence required to approximate some target function, and examines the interplay between length complexity and other notions of complexity.","arXiv.org",2023,"Eran Malach",5,48,0
"5ee871537ae51e7e2e93d2a70fff5d100649a655","https://www.semanticscholar.org/paper/5ee871537ae51e7e2e93d2a70fff5d100649a655",2,"Mathematical Language Models: A Survey","A comprehensive survey of mathematical LMs is conducted, systematically categorizing pivotal research endeavors from two distinct perspectives: tasks and methodologies, revealing a large number of proposed mathematical LLMs.","arXiv.org",2023,"Wentao Liu,Hanglei Hu,Jie Zhou,Yuyang Ding,Junsong Li,Jiayi Zeng,Mengliang He,Qin Chen,Bo Jiang,Aimin Zhou,Liang He",0,220,0
"4372100e5f676b0a2db93a97b6b1e45ae593b75e","https://www.semanticscholar.org/paper/4372100e5f676b0a2db93a97b6b1e45ae593b75e",2,"Understanding the Effect of Noise in LLM Training Data with Algorithmic Chains of Thought","This work develops the Traced Integer framework to generate highly customizable noised execution traces for any arithmetic function on lists of integers and evaluates the test performance of pretrained models both prompted and fine-tuned on noised datasets with varying levels of dataset contamination and intensity.","arXiv.org",2024,"Alex Havrilla,Maia Iyer",0,43,0
"3dc9eb80b806f2db14a45216a7fd840153f45a07","https://www.semanticscholar.org/paper/3dc9eb80b806f2db14a45216a7fd840153f45a07",1,"Don’t be Blind to Questions: Question-Oriented Math Word Problem Solving","This approach features an entity-aware encoder that enhances the connection between MWP context and question via entities in established dependency graphs, aiming at obtaining better problem representations and a question-guided decoder is trained using a contrastive learning strategy to enhance the question representations.","International Joint Conference on Natural Language Processing",2023,"Zhenwen Liang,Jipeng Zhang,Xiangliang Zhang",0,49,0
"0b47c8eae44c8c3c5f474d1b9869ba90a5199eae","https://www.semanticscholar.org/paper/0b47c8eae44c8c3c5f474d1b9869ba90a5199eae",1,"Math Word Problem Solving by Generating Linguistic Variants of Problem Statements","This paper proposes a framework for MWP solvers based on the generation of linguistic variants of the problem text and shows that training on linguistic variant of problem statements and voting on candidate predictions improve the mathematical reasoning and robustness of the model.","Proceedings of the 61st Annual Meeting of the Association for Computational Linguistics (Volume 4: Student Research Workshop)",2023,"Syed Rifat Raiyan,Md. Nafis Faiyaz,S. Kabir,Mohsinul Kabir,H. Mahmud,Md. Kamrul Hasan",1,111,0
"c1c93b4916aa5b8ce1d99a9e59c700e3d13ada36","https://www.semanticscholar.org/paper/c1c93b4916aa5b8ce1d99a9e59c700e3d13ada36",1,"MinT: Boosting Generalization in Mathematical Reasoning via Multi-View Fine-Tuning","This work introduces a multi-view fine-tuning method that efficiently exploits existing mathematical problem datasets with diverse annotation styles, and uniquely considers the various annotation formats as different""views"" and leverages them in training the model.","arXiv.org",2023,"Zhenwen Liang,Dian Yu,Xiaoman Pan,Wenlin Yao,Qingkai Zeng,Xiangliang Zhang,Dong Yu",4,45,0
"e1414fc1e1a6752524a1807a29ee406e8d808849","https://www.semanticscholar.org/paper/e1414fc1e1a6752524a1807a29ee406e8d808849",1,"Auto-Instruct: Automatic Instruction Generation and Ranking for Black-Box Language Models","This paper introduces Auto-Instruct, a novel method to automatically improve the quality of instructions provided to LLMs, and leverages the inherent generative ability of LLMs to produce diverse candidate instructions for a given task, and then ranks them using a scoring model trained on a variety of 575 existing NLP tasks.","Conference on Empirical Methods in Natural Language Processing",2023,"Zhihan Zhang,Shuo Wang,W. Yu,Yichong Xu,Dan Iter,Qingkai Zeng,Yang Liu,Chenguang Zhu,Meng Jiang",5,38,0
"98b607e7cb84e1a5c87c8a49562ae35435e6722d","https://www.semanticscholar.org/paper/98b607e7cb84e1a5c87c8a49562ae35435e6722d",1,"Learning From Mistakes Makes LLM Better Reasoner","Experiments show that \textsc{LeMa} consistently improves CoT-alone fine-tuning and sheds light on the non-homogeneous effectiveness between CoT data and correction data, and the contribution from different correction information.","arXiv.org",2023,"Shengnan An,Zexiong Ma,Zeqi Lin,Nanning Zheng,Jian-Guang Lou,Weizhu Chen",9,56,3
"631b5baa2c34f7095ccdd8761086b49148071d78","https://www.semanticscholar.org/paper/631b5baa2c34f7095ccdd8761086b49148071d78",1,"Knowledge Distillation of LLM for Automatic Scoring of Science Education Assessments","A method for knowledge distillation of fine-tuned Large Language Models into smaller, more efficient, and accurate neural networks that has potential to make advanced AI technologies accessible in typical educational settings, particularly for automatic scoring.","",2023,"Ehsan Latif,Luyang Fang,Ping Ma,Xiaoming Zhai",0,39,0
"1a6bd4f70bceb26ddb722ce98c0eae2a64147048","https://www.semanticscholar.org/paper/1a6bd4f70bceb26ddb722ce98c0eae2a64147048",1,"Knowledge-Based and Generative-AI-Driven Pedagogical Conversational Agents: A Comparative Study of Grice's Cooperative Principles and Trust","This paper investigates how a very limited amount of domain-specific data can be used to build knowledge-based and generative educational chatbots and finds that knowledge-based chatbots allow full control over the system’s response but lack the verbosity and flexibility of GLMs.","Big Data and Cognitive Computing",2023,"Matthias Wölfel,Mehrnoush Barani Shirzad,Andreas Reich,Katharina Anderer",0,71,0
"04cc5744fe8b436fb0f8b2763ed8ac7e4a60f7d1","https://www.semanticscholar.org/paper/04cc5744fe8b436fb0f8b2763ed8ac7e4a60f7d1",1,"Combining GPT and Colab as learning tools for students to explore the numerical solutions of difference equations","","Eurasia Journal of Mathematics, Science and Technology Education",2024,"Supot Seebut,Patcharee Wongsason,Dojin Kim",0,48,0
"8f070e301979732e0dd73f6aa6170309cf73aa7d","https://www.semanticscholar.org/paper/8f070e301979732e0dd73f6aa6170309cf73aa7d",1,"Large Language Model based Multi-Agents: A Survey of Progress and Challenges","This survey is presented to offer an in-depth discussion on the essential aspects of multi-agent systems based on LLMs, as well as the challenges.","arXiv.org",2024,"Taicheng Guo,Xiuying Chen,Yaqi Wang,Ruidi Chang,Shichao Pei,N. Chawla,Olaf Wiest,Xiangliang Zhang",5,77,0
"d43587743abd006be30756b67efd87f61671412b","https://www.semanticscholar.org/paper/d43587743abd006be30756b67efd87f61671412b",1,"Tartare: Automatic Generation of C Pointer Statements and Feedback","The techniques implemented in Tartare are described, relying on a pattern template-based approach, and it is believed the approach for Tartare can be transposed for automatic exercises generation in various other fields.","IFAC Symposium on Advances in Control Education",2024,"Géraldine Brieven,Valentin Baum,Benoit Donnet",0,49,0
"42445823fb0156afddc8c72eaa5ee81dded5b965","https://www.semanticscholar.org/paper/42445823fb0156afddc8c72eaa5ee81dded5b965",1,"Large Language Models for Mathematical Reasoning: Progresses and Challenges","This survey stands as one of the first extensive examinations of the landscape of LLM-oriented techniques in the realm of mathematics, providing a holistic perspective on the current state, accomplishments, and future challenges in this rapidly evolving field.","arXiv.org",2024,"Janice Ahn,Rishu Verma,Renze Lou,Di Liu,Rui Zhang,Wenpeng Yin",4,92,0
"7f4bdef8c9d660af6b18a55de0699e5e65ce3b54","https://www.semanticscholar.org/paper/7f4bdef8c9d660af6b18a55de0699e5e65ce3b54",1,"Plan-Grounded Large Language Models for Dual Goal Conversational Settings","A novel LLM is proposed that grounds the dialogue on a procedural plan, can take the dialogue initiative, and enforces guardrails on the system's behavior, while also improving the LLM's responses to unexpected user behavior.","arXiv.org",2024,"Diogo Glória-Silva,Rafael Ferreira,Diogo Tavares,David Semedo,João Magalhães",1,43,0
"edc5b4b2b89718b42dc90192960084166b7987d8","https://www.semanticscholar.org/paper/edc5b4b2b89718b42dc90192960084166b7987d8",1,"Multi-Intent Attribute-Aware Text Matching in Searching","This work proposes a multi-intent attribute-aware matching model (MIM), which consists of three main components: attribute-aware encoder, multi-intent modeling, and intent-aware matching, which consists of three main components: attribute-aware encoder, multi-intent modeling, and intent-aware matching.","arXiv.org",2024,"Mingzhe Li,Xiuying Chen,Jing Xiang,Qishen Zhang,Changsheng Ma,Chenchen Dai,Jinxiong Chang,Zhongyi Liu,Guannan Zhang",0,41,0
"f5df0667365764a970fc6abfa0a68b7d1d0ae413","https://www.semanticscholar.org/paper/f5df0667365764a970fc6abfa0a68b7d1d0ae413",1,"Patchscopes: A Unifying Framework for Inspecting Hidden Representations of Language Models","It is shown that prior interpretability methods based on projecting representations into the vocabulary space and intervening on the LLM computation can be viewed as instances of this framework, and several of their shortcomings such as failure in inspecting early layers or lack of expressivity can be mitigated by Patchscopes.","arXiv.org",2024,"Asma Ghandeharioun,Avi Caciularu,Adam Pearce,Lucas Dixon,Mor Geva",6,64,1
"a14e999e8826f98cfd1cac9dd7baa4d0b61f7266","https://www.semanticscholar.org/paper/a14e999e8826f98cfd1cac9dd7baa4d0b61f7266",1,"Increasing Trust in Language Models through the Reuse of Verified Circuits","This paper fully verify a model for n-digit integer addition and discusses how inserting verified task modules into LMs can leverage model reuse to improve verifiability and trustworthiness of language models built using them.","arXiv.org",2024,"Philip Quirke,Clement Neo,Fazl Barez",0,17,0
"a05148b077418259989511ed8031ce05689a16aa","https://www.semanticscholar.org/paper/a05148b077418259989511ed8031ce05689a16aa",1,"AtP*: An efficient and scalable method for localizing LLM behaviour to components","This work investigates Attribution Patching (AtP), a fast gradient-based approximation to Activation Patching and finds two classes of failure modes of AtP which lead to significant false negatives, and proposes a variant of AtP called AtP*, with two changes to address these failure modes while retaining scalability.","",2024,"J'anos Kram'ar,Tom Lieberum,Rohin Shah,Neel Nanda",0,48,0
"b16d916ce411be0b1c7b6139317c652927984f46","https://www.semanticscholar.org/paper/b16d916ce411be0b1c7b6139317c652927984f46",1,"Tokenization on the Number Line is All You Need","This work proposes vocabulary 018 level changes in the decoding stage and studies its behavior and finds that changes at the 032 tokenization level achieve near state-of-the-art results while requiring minimal resources com-034 pared to other number representation schemes.","",2021,"",0,14,0
"b59947541d2ac4211c4b17554b2e16c260299bed","https://www.semanticscholar.org/paper/b59947541d2ac4211c4b17554b2e16c260299bed",1,"Have You Seen That Number? Investigating Extrapolation in Question Answering Models","This work rigorously tests state-of-the-art models on DROP, a numerical MRC dataset, and proposes the E-digit number form that alleviates the lack of extrapolation in models and reveals the need to treat numbers differently from regular words in the text.","Conference on Empirical Methods in Natural Language Processing",2021,"Jeonghwan Kim,Giwon Hong,Kyung-min Kim,Junmo Kang,Sung-Hyon Myaeng",15,20,1
"e39dfab0477ae28dbb18d49beb9cd4c7ea30486c","https://www.semanticscholar.org/paper/e39dfab0477ae28dbb18d49beb9cd4c7ea30486c",1,"On the Abilities of Mathematical Extrapolation with Implicit Models","This paper compares the robustness of implicitly-defined and classical deep learning models on a series of mathematical extrapolation tasks, where the models are tested with out-of-distribution samples during inference time.","",2022,"H. Larochelle",1,21,0
"5df55d94ab5026ff84ec01871592108fbadbddbe","https://www.semanticscholar.org/paper/5df55d94ab5026ff84ec01871592108fbadbddbe",1,"Measurement Extraction with Natural Language Processing: A Review","In this review, an overview of prior work on measurement extraction is presented and different approaches to measurement extraction are described and the challenges posed by this task are outlined.","Conference on Empirical Methods in Natural Language Processing",2022,"Jan Göpfert,Patrick Kuckertz,J. Weinand,Leander Kotzur,D. Stolten",3,175,0
"f8a36a6c10b4f598f7a936f09c58de31c9e10bcd","https://www.semanticscholar.org/paper/f8a36a6c10b4f598f7a936f09c58de31c9e10bcd",1,"Controlling Neural Network Smoothness for Algorithmic Neural Reasoning","Investigation of the underlying hypothesis in the most simple conceivable scenario – the addition of real numbers finds that two layer neural networks fail to learn the structure of this task and that growing the network’s width leads to a complex division of input space.","",2022,"",0,25,0
"346accd49d1359aa3985c7b298bc2057ae642271","https://www.semanticscholar.org/paper/346accd49d1359aa3985c7b298bc2057ae642271",1,"One Clinician Is All You Need–Cardiac Magnetic Resonance Imaging Measurement Extraction: Deep Learning Algorithm Development","This study demonstrated that a domain-agnostic pretrained transformer model is able to effectively extract quantitative clinical measurements from diagnostic reports with a relatively small number of gold-standard annotations.","",2022,"Pulkit Singh,Julian S. Haimovich,C. Reeder,S. Khurshid,S. Emily,Lau,Jonathan W Cunningham,A. Philippakis,C. D. Anderson,J. Ho,S. Lubitz,P. Batra",0,37,0
"c27f3904490b8e5f9f39fe2b36722090c189e916","https://www.semanticscholar.org/paper/c27f3904490b8e5f9f39fe2b36722090c189e916",1,"Applying Structural and Dense Semantic Matching for the ARQMath Lab 2022, CLEF","This work describes the participation of the team in the ARQMath 2022 Lab, where two highly complementary methods for effective math answer and formula retrieval are applied, using a lexical sparse retriever and a fine-tuned bi-encoder dense retriever to capture contextual similarity and semantic matching.","Conference and Labs of the Evaluation Forum",2022,"Wei Zhong,Yuqing Xie,Jimmy J. Lin",5,68,0
"58d5e4cbb5f3a944bae0bcc2bff93f06696f8196","https://www.semanticscholar.org/paper/58d5e4cbb5f3a944bae0bcc2bff93f06696f8196",1,"JRIRD at the NTCIR-16 FinNum-3 Task: Investigating the Effect of Numerical Representations in Manager’s Claim Detection","The jointlearning withnumerical categories improved the performance of some pre-trained models and numeral format settings.","",2022,"Shunsuke Onuma,Kazuma Kadowaki",3,16,1
"6c84fc8c5ec823342f34a020f8b92b7064e96ca2","https://www.semanticscholar.org/paper/6c84fc8c5ec823342f34a020f8b92b7064e96ca2",1,"Towards Efficient and Robust Out-of-Distribution Deep Learning with Implicit Models","This paper shows how to decrease implicit model training time by harnessing the state-driven implicit modeling framework to safely eliminate features while maintaining model accuracy.","",2023,"Ashwin Ganesh",0,49,0
"1d6ca8d8401e14bbb764d35ba13a9505af0dcc2f","https://www.semanticscholar.org/paper/1d6ca8d8401e14bbb764d35ba13a9505af0dcc2f",1,"Controlling Neural Network Smoothness for Neural Algorithmic Reasoning","A tight linkage between the scaling of a network weights’ standard deviation and its effective length scale on a sinusoidal regression problem is demonstrated, suggesting simple modifications to control the length scale of the function learned by a neural network and, thus, its smoothness.","Trans. Mach. Learn. Res.",2023,"David A. Klindt",1,75,0
"3693683c4e0405819fae7115ad680f769eb83534","https://www.semanticscholar.org/paper/3693683c4e0405819fae7115ad680f769eb83534",1,"Neural Comprehension: Language Models with Compiled Neural Networks","The method, which call ""Neural Comprehension"", helps language models achieve absolute accuracy in symbolic operations, thereby enhancing their ability for rule reasoning, symbolic reasoning, and arithmetic reasoning.","arXiv.org",2023,"Yixuan Weng,Minjun Zhu,Fei Xia,Bin Li,Shizhu He,Kang Liu,Jun Zhao",4,66,0
"28a5a53dafacebad8a7c47773079caeffb9a5baa","https://www.semanticscholar.org/paper/28a5a53dafacebad8a7c47773079caeffb9a5baa",1,"Representing Numbers in NLP: a Survey and a Vision","This work synthesizes best practices for representing numbers in text and articulate a vision for holistic numeracy in NLP, comprised of design trade-offs and a unified evaluation.","North American Chapter of the Association for Computational Linguistics",2021,"Avijit Thawani,J. Pujara,Pedro A. Szekely,Filip Ilievski",80,70,4
"a35d5aeba08cccdc5cdf26bc094ccd71d06bdc99","https://www.semanticscholar.org/paper/a35d5aeba08cccdc5cdf26bc094ccd71d06bdc99",1,"Exploring Generalization Ability of Pretrained Language Models on Arithmetic and Logical Reasoning","This research finds that the PLMs can easily generalize when the distribution is the same, however, it is still difficult for them to generalize out of the distribution.","Natural Language Processing and Chinese Computing",2021,"Cunxiang Wang,Boyuan Zheng,Y. Niu,Yue Zhang",14,36,0
"9ca329408813d209b1dcb36936f7f9cba82506bd","https://www.semanticscholar.org/paper/9ca329408813d209b1dcb36936f7f9cba82506bd",1,"Train Short, Test Long: Attention with Linear Biases Enables Input Length Extrapolation","This work shows that extrapolation can be enabled by simply changing the position representation method, though it finds that current methods do not allow for efficient extrapolation, and introduces a simpler and more efficient position method, Attention with Linear Biases (ALiBi).","International Conference on Learning Representations",2021,"Ofir Press,Noah A. Smith,M. Lewis",317,48,51
"0f2199296f01694ee46b6059879260fb80a84fa6","https://www.semanticscholar.org/paper/0f2199296f01694ee46b6059879260fb80a84fa6",1,"Teaching Autoregressive Language Models Complex Tasks By Demonstration","The results suggest that fine-tuning autoregressive language models on small sets of well-crafted demonstrations may be a useful paradigm for enabling individuals without training in machine learning to coax such models to perform some kinds of complex multi-step tasks.","arXiv.org",2021,"Gabriel Recchia",18,47,1
"37588705a2af7d5b24d901dd33ade1ff293aabdd","https://www.semanticscholar.org/paper/37588705a2af7d5b24d901dd33ade1ff293aabdd",1,"Investigating Numeracy Learning Ability of a Text-to-Text Transfer Model","This work investigates the ability of text-to-text transfer learning model (T5), which has outperformed its predecessors in the conventional NLP tasks, to learn numeracy, to struggle considerably in the extrapolation setting across all four tasks.","Conference on Empirical Methods in Natural Language Processing",2021,"Kuntal Pal,Chitta Baral",15,18,1
"aead4418733b998792deb9cbf198a834449e00d2","https://www.semanticscholar.org/paper/aead4418733b998792deb9cbf198a834449e00d2",1,"Symbolic Brittleness in Sequence Models: on Systematic Generalization in Symbolic Mathematics","A methodology for evaluating generalization that takes advantage of the problem domain's structure and access to a verifier is developed, and the problem of symbolic mathematical integration is considered, as it requires generalizing systematically beyond the training set.","AAAI Conference on Artificial Intelligence",2021,"S. Welleck,Peter West,Jize Cao,Yejin Choi",18,35,1
"b8b813111c411ae61881ab9cd25707d9de6444ec","https://www.semanticscholar.org/paper/b8b813111c411ae61881ab9cd25707d9de6444ec",1,"Compositional Attention: Disentangling Search and Retrieval","This work proposes a novel attention mechanism, called Compositional Attention, that replaces the standard head structure, and demonstrates that it outperforms standard multi-head attention on a variety of tasks, including some out-of-distribution settings.","arXiv.org",2021,"Sarthak Mittal,S. Raparthy,I. Rish,Yoshua Bengio,Guillaume Lajoie",11,52,1
"45ece6f3b0a319dba60c20b3013b5161dd49c58b","https://www.semanticscholar.org/paper/45ece6f3b0a319dba60c20b3013b5161dd49c58b",1,"Linear algebra with transformers","Nine problems of linear algebra are studied, from basic matrix operations to eigenvalue decomposition and inversion, and four encoding schemes to represent real numbers are introduced.","Trans. Mach. Learn. Res.",2021,"Franccois Charton",33,68,2
"edd80013e8b9fcba9231cf99884f32e5236ff329","https://www.semanticscholar.org/paper/edd80013e8b9fcba9231cf99884f32e5236ff329",1,"AA-TransUNet: Attention Augmented TransUNet For Nowcasting Tasks","A novel data-driven predictive model based on TransUNet for precipitation nowcasting task and shows that the proposed model outperforms other examined models on both tested datasets.","IEEE International Joint Conference on Neural Network",2022,"Yimin Yang,S. Mehrkanoon",22,36,3
"7a25155364476839b6d1fc0653cd8611327ab9ba","https://www.semanticscholar.org/paper/7a25155364476839b6d1fc0653cd8611327ab9ba",1,"mGPT: Few-Shot Learners Go Multilingual",,"Transactions of the Association for Computational Linguistics",2022,"Oleh Shliazhko,Alena Fenogenova,M. Tikhonova,V. Mikhailov,A. Kozlova,Tatiana Shavrina",71,116,7
"4f39ab027947f49fa9a9c919c2c09bbbe0bf7f80","https://www.semanticscholar.org/paper/4f39ab027947f49fa9a9c919c2c09bbbe0bf7f80",1,"Beyond Distributional Hypothesis: Let Language Models Learn Meaning-Text Correspondence","A novel intermediate training task, names meaning-matching, designed to directly learn a meaning-text correspondence, is proposed that enables PLMs to learn lexical semantic information and is found to be a safe intermediate task that guarantees a similar or better performance of downstream tasks.","NAACL-HLT",2022,"Myeongjun Jang,Frank Mtumbuka,Thomas Lukasiewicz",6,53,1
