"id","url","score","title","summary","venue","year","authors","citationCount","referenceCount","influentialCitationCount"
"28a5a53dafacebad8a7c47773079caeffb9a5baa","https://www.semanticscholar.org/paper/28a5a53dafacebad8a7c47773079caeffb9a5baa",9,"Representing Numbers in NLP: a Survey and a Vision","This work synthesizes best practices for representing numbers in text and articulate a vision for holistic numeracy in NLP, comprised of design trade-offs and a unified evaluation.","North American Chapter of the Association for Computational Linguistics",2021,"Avijit Thawani,J. Pujara,Pedro A. Szekely,Filip Ilievski",44,68,3
"c2d50f17ea6769f6f5663ccac37a9627a0543184","https://www.semanticscholar.org/paper/c2d50f17ea6769f6f5663ccac37a9627a0543184",6,"I NVESTIGATING THE L IMITATIONS OF T RANSFORM ERS WITH S IMPLE A RITHMETIC T ASKS","It is concluded that modern pretrained language models can easily learn arithmetic from very few examples, as long as they use the proper surface representation, which bolsters evidence that subword tokenizers and positional encodings are compo-nents in current transformer designs that might need improvement.","",,"",0,0,0
"8424082e3bf4792462eb112d7ebcecf5b0dc3613","https://www.semanticscholar.org/paper/8424082e3bf4792462eb112d7ebcecf5b0dc3613",6,"Reasoning with Transformer-based Models: Deep Learning, but Shallow Reasoning","This survey paper discusses the performance of transformers on different reasoning tasks, including mathematical reasoning, commonsense reasoning, and logical reasoning.","Conference on Automated Knowledge Base Construction",2021,"Chadi Helwe,C. Clavel,Fabian M. Suchanek",15,95,4
"d3a7a4543d83f568f79d1febe8379465ff0140c9","https://www.semanticscholar.org/paper/d3a7a4543d83f568f79d1febe8379465ff0140c9",5,"A Survey of Deep Learning for Mathematical Reasoning","This survey paper reviews the key tasks, datasets, and methods at the intersec-tion of mathematical reasoning and deep learning over the past decade, and evaluates existing benchmarks and methods and discusses future research directions.","ArXiv",2022,"Pan Lu,Liang Qiu,Wenhao Yu,S. Welleck,Kai-Wei Chang",1,216,1
"37588705a2af7d5b24d901dd33ade1ff293aabdd","https://www.semanticscholar.org/paper/37588705a2af7d5b24d901dd33ade1ff293aabdd",4,"Investigating Numeracy Learning Ability of a Text-to-Text Transfer Model","This work investigates the ability of text-to-text transfer learning model (T5), which has outperformed its predecessors in the conventional NLP tasks, to learn numeracy, and considers four numeracy tasks.","Conference on Empirical Methods in Natural Language Processing",2021,"K. Pal,Chitta Baral",9,18,1
"d331de3b6bebb0f9af1fddf1b730ec057a7026d4","https://www.semanticscholar.org/paper/d331de3b6bebb0f9af1fddf1b730ec057a7026d4",4,"Relational World Knowledge Representation in Contextual Language Models: A Review","This work proposes to organize knowledge representation strategies in LMs by the level of KB supervision provided, from no KB supervision at all to entity- and relation-level supervision, and provides a high-level, extensible taxonomy for knowledge representation in L Ms.","Conference on Empirical Methods in Natural Language Processing",2021,"Tara Safavi,Danai Koutra",17,143,1
"0e6e8274d0dcbc1c3c1ccdbd87f3e5d53fdf62b4","https://www.semanticscholar.org/paper/0e6e8274d0dcbc1c3c1ccdbd87f3e5d53fdf62b4",4,"QA Dataset Explosion: A Taxonomy of NLP Resources for Question Answering and Reading Comprehension","This study is the largest survey of the deep learning models in NLP field to date, providing an overview of the various formats and domains of the current resources, and highlighting the current lacunae for future work.","ACM Computing Surveys",2021,"Anna Rogers,Matt Gardner,Isabelle Augenstein",53,343,3
"1525c819ecaed99dad8117da1206eff3d470756d","https://www.semanticscholar.org/paper/1525c819ecaed99dad8117da1206eff3d470756d",4,"Benchmarks for Automated Commonsense Reasoning: A Survey","A survey of the development and uses of AI commonsense benchmarks, and it is argued that it is worthwhile to invest the work needed ensure that benchmark examples are consistently high quality.","ArXiv",2023,"E. Davis",1,168,0
"6c1e1cc1e0e1f8fd026fe517607b2d4535565fa7","https://www.semanticscholar.org/paper/6c1e1cc1e0e1f8fd026fe517607b2d4535565fa7",3,"PAL: Program-aided Language Models","Program-Aided Language models (P A L): a novel approach that uses the LLM to read natural language problems and generate programs as the intermediate reasoning steps, but ofﬂoads the solution step to a runtime such as a Python interpreter.","ArXiv",2022,"Luyu Gao,Aman Madaan,Shuyan Zhou,Uri Alon,Pengfei Liu,Yiming Yang,Jamie Callan,Graham Neubig",16,57,6
"6756fcd998caeb7b23702e08559e63710179334c","https://www.semanticscholar.org/paper/6756fcd998caeb7b23702e08559e63710179334c",3,"Reasoning with Language Model Prompting: A Survey","This paper provides a comprehensive survey of cutting-edge research on reasoning with language model prompting and introduces research works with comparisons and summaries and provides systematic resources to help beginners.","ArXiv",2022,"Shuofei Qiao,Yixin Ou,Ningyu Zhang,Xiang Chen,Yunzhi Yao,Shumin Deng,Chuanqi Tan,Fei Huang,Huajun Chen",6,150,0
"0f2199296f01694ee46b6059879260fb80a84fa6","https://www.semanticscholar.org/paper/0f2199296f01694ee46b6059879260fb80a84fa6",3,"Teaching Autoregressive Language Models Complex Tasks By Demonstration","The results suggest that fine-tuning autoregressive language models on small sets of well-crafted demonstrations may be a useful paradigm for enabling individuals without training in machine learning to coax such models to perform some kinds of complex multi-step tasks.","ArXiv",2021,"Gabriel Recchia",15,48,1
"1b6e810ce0afd0dd093f789d2b2742d047e316d5","https://www.semanticscholar.org/paper/1b6e810ce0afd0dd093f789d2b2742d047e316d5",3,"Chain of Thought Prompting Elicits Reasoning in Large Language Models","Experiments on three large language models show that chain-of-thought prompting improves performance on a range of arithmetic, commonsense, and symbolic reasoning tasks.","ArXiv",2022,"Jason Wei,Xuezhi Wang,Dale Schuurmans,Maarten Bosma,E. Chi,Quoc Le,Denny Zhou",345,103,95
"3ee9c65366efbb17adf370c39f20dbef60d53670","https://www.semanticscholar.org/paper/3ee9c65366efbb17adf370c39f20dbef60d53670",3,"Towards Reasoning in Large Language Models: A Survey","A comprehensive overview of the current state of knowledge on reasoning in large language models, including techniques for improving and eliciting reasoning in these models, methods and benchmarks for evaluating reasoning abilities, and suggestions on future directions are provided.","ArXiv",2022,"Jie Huang,K. Chang",4,103,0
"884c0b6db564208d99cadf2548f0aa96dee5f859","https://www.semanticscholar.org/paper/884c0b6db564208d99cadf2548f0aa96dee5f859",3,"Commonsense Reasoning with Implicit Knowledge in Natural Language","This work takes a middle ground where it uses smaller language models together with a relatively smaller but targeted natural language text corpora and proposes four methods competitive to state-of-the-art methods to reason with implicit commonsense.","Conference on Automated Knowledge Base Construction",2021,"Pratyay Banerjee,Swaroop Mishra",2,73,0
"def7c67c3688bc459fbef3ce50a466a0cbf411a9","https://www.semanticscholar.org/paper/def7c67c3688bc459fbef3ce50a466a0cbf411a9",3,"A Primer for Neural Arithmetic Logic Modules","Focusing on the shortcomings of NALU, an in-depth analysis is provided to reason about design choices of recent units to highlight inconsistencies in a fundamental experiment causing the inability to directly compare across papers.","ArXiv",2021,"Bhumika Mistry,K. Farrahi,Jonathon Hare",4,54,0
"c36277b67814e0a522e786a38e1768612b0e63f2","https://www.semanticscholar.org/paper/c36277b67814e0a522e786a38e1768612b0e63f2",3,"Exploring the Learning Mechanisms of Neural Division Modules","It is shown that robustly learning division in a systematic manner remains a challenge even at the simplest level of dividing two numbers, and a novel approach to division is proposed which is called the Neural Reciprocal Unit (NRU) and the Neural Multiplicative Reciproc Unit (NMRU).","",2022,"Bhumika Mistry",0,23,0
"ff8f3dfd9e2f4a92310999722abefab202935521","https://www.semanticscholar.org/paper/ff8f3dfd9e2f4a92310999722abefab202935521",3,"Do Language Models Understand Measurements?","This study shows that PLMs lack the capability required for reasoning over measurements, and proposes a simple embedding strategy to better distinguish between numbers and units, which leads to a significant improvement in the probing tasks.","Conference on Empirical Methods in Natural Language Processing",2022,"Sungjin Park,Seung-kook Ryu,E. Choi",0,26,0
"9a9e68d400069f023f7dc9b982226c95159a509d","https://www.semanticscholar.org/paper/9a9e68d400069f023f7dc9b982226c95159a509d",3,"Dissociating language and thought in large language models: a cognitive perspective","","ArXiv",2023,"Kyle Mahowald,Anna A. Ivanova,I. Blank,N. Kanwisher,J. Tenenbaum,Evelina Fedorenko",7,412,0
"ccbc69b6e187b9a1614f76c5ede30b139f3dc9fb","https://www.semanticscholar.org/paper/ccbc69b6e187b9a1614f76c5ede30b139f3dc9fb",3,"Identify, Align, and Integrate: Matching Knowledge Graphs to Commonsense Reasoning Tasks","This work presents an approach to assess how well a candidate KG can correctly identify and accurately fill in gaps of reasoning for a task, which is called KG-to-task match and demonstrates that ATOMIC, an event-inference focused KG, is the best match for SIQA and MCScript2.0, and that the taxonomic ConceptNet and WikiHow-based KGs are the bestmatch for PIQA across all 3 analysis phases.","Conference of the European Chapter of the Association for Computational Linguistics",2021,"Lisa Bauer",10,40,1
"6597d61bdb531051678c773526758a6dc113b9ce","https://www.semanticscholar.org/paper/6597d61bdb531051678c773526758a6dc113b9ce",3,"COM2SENSE: A Commonsense Reasoning Benchmark with Complementary Sentences","This work introduces a new commonsense reasoning benchmark dataset comprising natural language true/false statements, with each sample paired with its complementary counterpart, resulting in 4k sentence pairs, and proposes a pairwise accuracy metric to reliably measure an agent’s ability to perform Commonsense reasoning over a given situation.","Findings",2021,"Shikhar Singh,Nuan Wen,Yu Hou,Pegah Alipoormolabashi,Te-Lin Wu,Xuezhe Ma,Nanyun Peng",13,51,6
"62953ca1252c9febe07c7007a10911726f37792d","https://www.semanticscholar.org/paper/62953ca1252c9febe07c7007a10911726f37792d",3,"TIMEDIAL: Temporal Commonsense Reasoning in Dialog","This paper presents the first study to investigate pre-trained LMs for their temporal reasoning capabilities in dialogs by introducing a new task and a crowd-sourced English challenge set, TimeDial, and reveals that the models fail to reason about dialog context correctly; instead, they rely on shallow cues based on existing temporal patterns in context.","Annual Meeting of the Association for Computational Linguistics",2021,"Lianhui Qin,Aditya Gupta,Shyam Upadhyay,Luheng He,Yejin Choi,Manaal Faruqui",23,48,3
"c9343c26a0e604f7afd94b7290bbdf8d96cd65b6","https://www.semanticscholar.org/paper/c9343c26a0e604f7afd94b7290bbdf8d96cd65b6",3,"Predicting Numerals in Natural Language Text Using a Language Model Considering the Quantitative Aspects of Numerals","This paper measures the NCS acquired by existing neural language models using a masked numeral prediction task as an evaluation task and proposes methods to reflect not only the symbolic aspect but also the quantitative aspect of numerals in the training of language models, using a loss function that depends on the magnitudes of the numerals and a regression model for the masked numal prediction task.","Workshop on Knowledge Extraction and Integration for Deep Learning Architectures; Deep Learning Inside Out",2021,"Taku Sakamoto,Akiko Aizawa",1,23,0
"957424a1f3319a2aab1a91539a00e712477b4b4a","https://www.semanticscholar.org/paper/957424a1f3319a2aab1a91539a00e712477b4b4a",3,"Self-Attention Networks Can Process Bounded Hierarchical Languages","It is proved that self-attention networks can process Dyck-(k, D), the subset of Dyck-k with depth bounded by D, which arguably better captures the bounded hierarchical structure of natural language.","Annual Meeting of the Association for Computational Linguistics",2021,"Shunyu Yao,Binghui Peng,C. Papadimitriou,Karthik Narasimhan",9,52,2
"f729e16ee6765e2fd76772cbf9d3dd17b4d25438","https://www.semanticscholar.org/paper/f729e16ee6765e2fd76772cbf9d3dd17b4d25438",2,"Towards Tractable Mathematical Reasoning: Challenges, Strategies, and Opportunities for Solving Math Word Problems","This work inspects non-neural and neural methods to solve math word problems narrated in a natural language, and highlights the ability of these methods to be generalizable, mathematically reasonable, interpretable, and explainable.","ArXiv",2021,"Keyur Faldu,A. Sheth,Prashant Kikani,Manas Gaur,Aditi Avasthi",6,75,2
"c9f48406851954cb098911eccb4124ea5f966675","https://www.semanticscholar.org/paper/c9f48406851954cb098911eccb4124ea5f966675",2,"A Survey on Multi-hop Question Answering and Generation","A general and formal definition of MHQA task is provided, the existing attempts to this highly interesting, yet quite challenging task are summarized, and the best methods to createMHQA datasets are outlined.","ArXiv",2022,"Vaibhav Mavi,Anubhav Jangra,A. Jatowt",4,183,0
"2fe6060ced80c1c245a718e6188b6516207bf0a8","https://www.semanticscholar.org/paper/2fe6060ced80c1c245a718e6188b6516207bf0a8",2,"Augmenting Operations Research with Auto-Formulation of Optimization Models from Problem Descriptions","An augmented intelligence system for simplifying and enhancing the modeling experience for operations research is described that receives a suggested formulation of an optimization problem based on its description and enables the users to validate and edit the suggestions.","ArXiv",2022,"Rindranirina Ramamonjison,Haley Li,Timothy T. Yu,Shiqi He,Vishnu Rengan,Amin Banitalebi-Dehkordi,Zirui Zhou,Yong Zhang",6,40,1
"262d6a0f6eb3f4c81e47fecd7e14be004295a7cf","https://www.semanticscholar.org/paper/262d6a0f6eb3f4c81e47fecd7e14be004295a7cf",2,"A Causal Framework to Quantify the Robustness of Mathematical Reasoning with Language Models","This work proposes a novel framework, which pins down the causal effect of various factors in the input, e.g., the surface form of the problem text, the operands and math operators on the output solution, and shows that robustness does not appear to continuously improve as a function of scale, but that the recent GPT-3-Instruct achieves a dra-matic improvement in both robustness and sensitivity, compared to all other GPT variants.","ArXiv",2022,"Alessandro Stolfo,Zhijing Jin,K. Shridhar,B. Schölkopf,Mrinmaya Sachan",2,55,0
"598d9b235f5ab148fc757240d9bc39a47b8eaf72","https://www.semanticscholar.org/paper/598d9b235f5ab148fc757240d9bc39a47b8eaf72",2,"Program of Thoughts Prompting: Disentangling Computation from Reasoning for Numerical Reasoning Tasks","Under both few-shot and zero-shot settings, PoT can show an average performance gain over CoT by around 12% across all the evaluated datasets, and by combining PoT with self-consistency decoding, can achieve SoT performance on all math problem datasets and near-SoTA performance on ﬁnancial datasets.","ArXiv",2022,"Wenhu Chen,Xueguang Ma,Xinyi Wang,William W. Cohen",19,38,5
"72d53421ec2179e1116b7aada77941213213135c","https://www.semanticscholar.org/paper/72d53421ec2179e1116b7aada77941213213135c",2,"A Categorical Archive of ChatGPT Failures","","ArXiv",2023,"A. Borji",1,33,0
"c78f267dfcca001384cb0d4e3b8de0173adc162d","https://www.semanticscholar.org/paper/c78f267dfcca001384cb0d4e3b8de0173adc162d",2,"Applying Structural and Dense Semantic Matching for the ARQMath Lab 2022, CLEF","This work describes the participation of the team in the ARQMath 2022 Lab, where two highly complementary methods for effective math answer and formula retrieval are applied, using a lexical sparse retriever and a fine-tuned bi-encoder dense retriever to capture contextual similarity and semantic matching.","Conference and Labs of the Evaluation Forum",2022,"Wei Zhong,Yuqing Xie,Jimmy J. Lin",2,58,0
"a5808ccc50f77083bd3be926fb2af05cf34563ff","https://www.semanticscholar.org/paper/a5808ccc50f77083bd3be926fb2af05cf34563ff",2,"Evaluating Transformer Language Models on Arithmetic Operations Using Number Decomposition","The ability of Transformer Language Models to perform arithmetic operations following a pipeline that, before performing computations, decomposes numbers in units, tens, and so on is evaluated.","International Conference on Language Resources and Evaluation",2022,"Matteo Muffo,A. Cocco,Enrico Bertino",3,22,0
"1f036b092a74f0c2f7eef37daa16eeb0f5954d9b","https://www.semanticscholar.org/paper/1f036b092a74f0c2f7eef37daa16eeb0f5954d9b",2,"Development of a Neural Network-Based Mathematical Operation Protocol for Embedded Hexadecimal Digits Using Neural Architecture Search (NAS)","A comparison between human-developed machine learning model and models sampled through Neural Architecture Search (NAS) determine an efficient approach to solve the problem of addition using embedded hexadecimal digits.","ArXiv",2022,"Victor Robila,Kexin Pei,Junfeng Yang",0,20,0
"1a174b63d294f96568517b91f2c8d6c9362118b5","https://www.semanticscholar.org/paper/1a174b63d294f96568517b91f2c8d6c9362118b5",2,"Towards Robust Numerical Question Answering: Diagnosing Numerical Capabilities of NLP Systems","This paper proposes to conduct numerical capability diagnosis on a series of Numerical Question Answering systems and datasets and investigates the effectiveness of applying perturbations as data augmentation to relieve systems’ lack of robust numerical capabilities.","Conference on Empirical Methods in Natural Language Processing",2022,"Jialiang Xu,Mengyu Zhou,Xinyi He,Shi Han,Dongmei Zhang",0,47,0
"965e409a3e7b5670d609837fac9823b160d6639c","https://www.semanticscholar.org/paper/965e409a3e7b5670d609837fac9823b160d6639c",2,"Logical Tasks for Measuring Extrapolation and Rule Comprehension","This work describes and characterize logical tasks and discusses system requirements for their solution, and discusses the relevance of logical tasks to concepts such as extrapolation, explainability, and inductive bias.","ArXiv",2022,"Ippei Fujisawa,R. Kanai",0,61,0
"4d17732d90440682b0500f4e209c6cc4fac20e0e","https://www.semanticscholar.org/paper/4d17732d90440682b0500f4e209c6cc4fac20e0e",2,"Teaching Algorithmic Reasoning via In-context Learning","This work shows that it is possible to teach algorithmic reasoning to LLMs via in-context learning, which it is referred to as algorithmic prompting, and evaluates the approach on a variety of arithmetic and quantitative reasoning tasks, and demonstrates boosts in performance over existing prompting techniques.","ArXiv",2022,"Hattie Zhou,Azade Nova,H. Larochelle,Aaron C. Courville,Behnam Neyshabur,Hanie Sedghi",6,70,3
"4c2534f9b03ac2f3810c07abc398a11bcf47258e","https://www.semanticscholar.org/paper/4c2534f9b03ac2f3810c07abc398a11bcf47258e",2,"Transformers Learn Shortcuts to Automata","The theoretical results completely characterize shortcut solutions, whereby a shallow Transformer with only o(T ) layers can exactly replicate the computation of an automaton on an input sequence of length T .","ArXiv",2022,"Bingbin Liu,J. Ash,Surbhi Goel,A. Krishnamurthy,Cyril Zhang",4,104,0
"41f44979cf1cd3f4cbd615dc130bc33721f5281b","https://www.semanticscholar.org/paper/41f44979cf1cd3f4cbd615dc130bc33721f5281b",2,"MemPrompt: Memory-assisted Prompt Editing with User Feedback","It is shown how a (simulated) user can interac-tively teach a deployed GPT -3, substantially increasing its accuracy over the queries with different kinds of misunderstandings by the GPT 3, a step towards the low-cost utility enhancement for very large pre-trained LMs.","",2022,"Aman Madaan,Niket Tandon,Peter Clark,Yiming Yang",1,41,0
"5e3a7235c730b512f0bb3004a6deb0c88ec9fc8e","https://www.semanticscholar.org/paper/5e3a7235c730b512f0bb3004a6deb0c88ec9fc8e",2,"On the Paradox of Learning to Reason from Data","This study pro-vides an explanation for this paradox: instead of learning to emulate the correct reasoning function, BERT has in fact learned statistical features that inherently exist in logical reasoning problems.","ArXiv",2022,"Honghua Zhang,Liunian Harold Li,Tao Meng,Kai-Wei Chang,Guy Van den Broeck",18,41,4
"1c1ca2392155ddf30408a442e6b504b5d60d4f2a","https://www.semanticscholar.org/paper/1c1ca2392155ddf30408a442e6b504b5d60d4f2a",2,"When to Make Exceptions: Exploring Language Models as Accounts of Human Moral Judgment","This paper presents a novel challenge set consisting of rule-breaking question answering (RBQA) of cases that involve potentially permissible rule- Breaking – inspired by recent moral psychology studies and proposes a novel moral chain of thought prompting strategy that combines the strengths of LLMs with theories of moral reasoning developed in cognitive science to predict human moral judgments.","ArXiv",2022,"Zhijing Jin,Sydney Levine,Fernando Gonzalez,Ojasv Kamal,Maarten Sap,Mrinmaya Sachan,Rada Mihalcea,J. Tenenbaum,B. Schölkopf",1,78,0
"833a2f1817cb9aeb292620454889cae78e26dda4","https://www.semanticscholar.org/paper/833a2f1817cb9aeb292620454889cae78e26dda4",2,"Impact of Pretraining Term Frequencies on Few-Shot Reasoning","Overall, although LMs exhibit strong performance at few-shot numerical reasoning tasks, the results raise the question of how much models actually generalize beyond pretraining data, and researchers are encouraged to take thepretraining data into account when interpreting evaluation results.","ArXiv",2022,"Yasaman Razeghi,Robert L Logan IV,Matt Gardner,Sameer Singh",53,54,4
"4f39ab027947f49fa9a9c919c2c09bbbe0bf7f80","https://www.semanticscholar.org/paper/4f39ab027947f49fa9a9c919c2c09bbbe0bf7f80",2,"Beyond Distributional Hypothesis: Let Language Models Learn Meaning-Text Correspondence","A novel intermediate training task, names meaning-matching, designed to directly learn a meaning-text correspondence, is proposed that enables PLMs to learn lexical semantic information and is found to be a safe intermediate task that guarantees a similar or better performance of downstream tasks.","NAACL-HLT",2022,"Myeongjun Jang,Frank Mtumbuka,Thomas Lukasiewicz",1,53,0
"0b7e9b6b588baa3f24fdde06feec26a067aa74bd","https://www.semanticscholar.org/paper/0b7e9b6b588baa3f24fdde06feec26a067aa74bd",2,"MultiHiertt: Numerical Reasoning over Multi Hierarchical Tabular and Textual Data","A new large-scale benchmark, MultiHiertt, with QA pairs over Multi Hierarchical Tabular and Textual data is constructed and a novel QA model termed MT2Net is introduced, which first applies facts retrieving to extract relevant supporting facts from both tables and text and then uses a reasoning module to perform symbolic reasoning over retrieved facts.","Annual Meeting of the Association for Computational Linguistics",2022,"Yilun Zhao,Yunxiang Li,Chenying Li,Rui Zhang",13,63,4
"20fae749e3d469c331731ffa2f811079db792fdc","https://www.semanticscholar.org/paper/20fae749e3d469c331731ffa2f811079db792fdc",2,"A Simple, Yet Effective Approach to Finding Biases in Code Generation","This work shows that current code generation systems exhibit biases inherited from large language model backbones, which might leak into generated code under specific circumstances, and proposes a framework that automatically removes hints and exposes various biases that these code generation models use.","ArXiv",2022,"Spyridon Mouselinos,Mateusz Malinowski,H. Michalewski",2,43,0
"6681f0a0cc6ddaa70cdea109b941c47538caaa27","https://www.semanticscholar.org/paper/6681f0a0cc6ddaa70cdea109b941c47538caaa27",2,"Judicial knowledge-enhanced magnitude-aware reasoning for numerical legal judgment prediction","","Artificial Intelligence and Law",2022,"Sheng Bi,Zhiyao Zhou,Lu Pan,G. Qi",1,27,0
"30fcba6760b5fc5235ef8a0f2a61ccff63a7c3a0","https://www.semanticscholar.org/paper/30fcba6760b5fc5235ef8a0f2a61ccff63a7c3a0",2,"MC-LSTM: Mass-Conserving LSTM","This work proposes a novel Mass-Conserving LSTM (MC-LSTM), which sets a new state-of-the-art for neural arithmetic units at learning arithmetic operations, such as addition tasks, which have a strong conservation law, as the sum is constant over time.","International Conference on Machine Learning",2021,"Pieter-Jan Hoedt,Frederik Kratzert,D. Klotz,Christina Halmich,Markus Holzleitner,G. Nearing,S. Hochreiter,G. Klambauer",13,108,4
"4578747d52aa1b3537612287352a803a7b17e999","https://www.semanticscholar.org/paper/4578747d52aa1b3537612287352a803a7b17e999",2,"Asynchronous Neural Networks for Learning in Graphs","It is proved that AMP can simulate synchronous GNNs and that it can theoretically distinguish any pair of graphs and experimentally validate AMP’s expressiveness.","ArXiv",2022,"Lukas Faber,Roger Wattenhofer",0,62,0
"0ce6a798f8222ed8f221326ca566311c648cb4dc","https://www.semanticscholar.org/paper/0ce6a798f8222ed8f221326ca566311c648cb4dc",2,"Learning Division with Neural Arithmetic Logic Modules","It is shown that robustly learning division in a systematic manner remains a challenge even at the simplest level of dividing two numbers, and two novel approaches for division are proposed which are called the Neural Reciprocal Unit (NRU) and the Neural Multiplicative Reciproc Unit (NMRU).","ArXiv",2021,"Bhumika Mistry,K. Farrahi,Jonathon Hare",0,13,0
