"id","url","score","title","summary","venue","year","authors","citationCount","referenceCount","influentialCitationCount"
"33149f835f391119d287cc2c6b009464e7d14fe4","https://www.semanticscholar.org/paper/33149f835f391119d287cc2c6b009464e7d14fe4",2,"On the Abilities of Mathematical Extrapolation with Implicit Models","This paper compares the robustness of implicitly-defined and classical deep learning models on a series of mathematical extrapolation tasks, where the models are tested with out-of-distribution samples during inference time to showcase implicit models’ unique advantages for mathematics extrapolation thanks to their flexible and selective framework.","",2022,"Juliette Decugis,Max Emerling,Ashwin Ganesh,Alicia Y. Tsai,L. Ghaoui",0,20,0
"26e07b6ac9b0f04396e2e7f7ca518b6fbae67ce7","https://www.semanticscholar.org/paper/26e07b6ac9b0f04396e2e7f7ca518b6fbae67ce7",2,"Improving the Robustness of Neural Multiplication Units with Reversible Stochasticity","It is shown that Neural Multiplication Units (NMUs) are unable to reliably learn tasks as simple as multiplying two inputs when given different training ranges, and stochasticity provides improved robustness with the potential to improve learned representations of upstream networks for numerical and image tasks.","ArXiv",2022,"Bhumika Mistry,K. Farrahi,Jonathon Hare",0,26,0
"eb2fc03b8865b8e1b4cb933d917ea269ebe14584","https://www.semanticscholar.org/paper/eb2fc03b8865b8e1b4cb933d917ea269ebe14584",2,"Learning from Mistakes: Using Mis-predictions as Harm Alerts in Language Pre-Training","It is argued that mis-predictions can help locate such dominating patterns that harm language understanding and propose a new language pre-training method, MisPredictions as Harm Alerts (MPA), which expedites the pre- training of BERT and ELECTRA and improves their performances on downstream tasks.","",2020,"Chen Xing,Wenhao Liu,Caiming Xiong",0,41,0
"011869f932f89d047ce2bd36d73a95cc04888193","https://www.semanticscholar.org/paper/011869f932f89d047ce2bd36d73a95cc04888193",2,"RICA: Evaluating Robust Inference Capabilities Based on Commonsense Axioms","A new challenge, RICA: Robust Inference using Commonsense Axioms, that evaluates robust commonsense inference despite textual perturbations and shows that PTLMs perform no better than random guessing on the zero-shot setting, are heavily impacted by statistical biases, and are not robust to perturbation attacks.","Conference on Empirical Methods in Natural Language Processing",2020,"Pei Zhou,Rahul Khanna,Bill Yuchen Lin,Daniel Ho,J. Pujara,Xiang Ren",23,55,1
"73b6de24eb0e5f6ff4f9c3bdd9257f4554faca19","https://www.semanticscholar.org/paper/73b6de24eb0e5f6ff4f9c3bdd9257f4554faca19",2,"Measuring and Improving Consistency in Pretrained Language Models","The creation of PARAREL, a high-quality resource of cloze-style query English paraphrases, and analysis of the representational spaces of PLMs suggest that they have a poor structure and are currently not suitable for representing knowledge in a robust way.","Transactions of the Association for Computational Linguistics",2021,"Yanai Elazar,Nora Kassner,Shauli Ravfogel,Abhilasha Ravichander,E. Hovy,Hinrich Schütze,Yoav Goldberg",66,83,20
"008b9fc834f5839a25febe150f3076d550ee442f","https://www.semanticscholar.org/paper/008b9fc834f5839a25febe150f3076d550ee442f",2,"Thinking Aloud: Dynamic Context Generation Improves Zero-Shot Reasoning Performance of GPT-2","","ArXiv",2021,"Gregor Betz,Kyle Richardson,C. Voigt",11,58,2
"5aab57cc0530560d82c74c055f664280619d7e81","https://www.semanticscholar.org/paper/5aab57cc0530560d82c74c055f664280619d7e81",2,"PROST: Physical Reasoning about Objects through Space and Time","It is demonstrated that state-of-the-art pretrained models are inadequate at physical reasoning: they are influenced by the order in which answer options are presented to them, they struggle when the superlative in a question is inverted, and increasing the amount of pretraining data and parameters only yields minimal improvements.","Findings",2021,"Stephane T Aroca-Ouellette,Cory Paik,A. Roncone,Katharina Kann",12,54,3
"d65a064eb837f838faf6ff67781b62450b92b159","https://www.semanticscholar.org/paper/d65a064eb837f838faf6ff67781b62450b92b159",2,"CommonsenseQA 2.0: Exposing the Limits of AI through Gamification","This work proposes gamiﬁcation as a framework for data construction and creates CommonsenseQA 2.0, which includes 14,343 yes/no questions, and demonstrates its difﬂculty for models that are orders-of-magnitude larger than the AI used in the game itself.","NeurIPS Datasets and Benchmarks",2021,"Alon Talmor,Ori Yoran,Ronan Le Bras,Chandrasekhar Bhagavatula,Yoav Goldberg,Yejin Choi,Jonathan Berant",40,61,7
"e55391a9406245584b3e5b3225dad2e171b9a06b","https://www.semanticscholar.org/paper/e55391a9406245584b3e5b3225dad2e171b9a06b",2,"RuleBERT: Teaching Soft Rules to Pre-Trained Language Models","This work introduces a classification task where, given facts and soft rules, thePLM should return a prediction with a probability for a given hypothesis, and proposes a revised loss function that enables the PLM to learn how to predict precise probabilities for the task.","Conference on Empirical Methods in Natural Language Processing",2021,"Mohammed Saeed,N. Ahmadi,Preslav Nakov,Paolo Papotti",9,53,1
"2af476f7c2a7c040fc9ab7750bf41a84f66aa947","https://www.semanticscholar.org/paper/2af476f7c2a7c040fc9ab7750bf41a84f66aa947",2,"Knowledge Based Multilingual Language Model","This work presents a novel framework to pretrain knowledge based multilingual language models (KMLMs) by generating a large amount of code-switched synthetic sentences and reasoning-based multilingual training data using the Wikidata knowledge graphs and designing pretraining tasks to facilitate knowledge learning.","ArXiv",2021,"Linlin Liu,Xin Li,Ruidan He,Lidong Bing,Shafiq R. Joty,Luo Si",8,29,4
"f4a2a13b5ff0f4b4a83f3b4effe84dbf8bb84884","https://www.semanticscholar.org/paper/f4a2a13b5ff0f4b4a83f3b4effe84dbf8bb84884",2,"LoNLI: An Extensible Framework for Testing Diverse Logical Reasoning Capabilities for NLI","This work proposes an extensible framework to collectively yet categorically test diverse LOgical reasoning capabilities required for NLI (and by extension, NLU) and creates a semi-synthetic large test-bench that offers following utilities: individually test and analyze reasoning capabilities along 17 reasoning dimensions (including pragmatic reasoning).","ArXiv",2021,"Ishan Tarunesh,Somak Aditya,M. Choudhury",4,58,1
"06396c7cd5d223a1776abf8811359ec7bc05d420","https://www.semanticscholar.org/paper/06396c7cd5d223a1776abf8811359ec7bc05d420",2,"Knowledge-Augmented Methods for Natural Language Processing","This tutorial introduces the key steps in integrating knowledge into NLP, including knowledge grounding from text, knowledge representation and fusing, and introduces recent state-of-the-art applications in fusing knowledge into language understanding, language generation and commonsense reasoning.","Annual Meeting of the Association for Computational Linguistics",2022,"Chenguang Zhu,Yichong Xu,Xiang Ren,Bill Yuchen Lin,Meng Jiang,Wenhao Yu",4,83,0
"44772fe1c3fa422a3da7e25092db2544893d6bfb","https://www.semanticscholar.org/paper/44772fe1c3fa422a3da7e25092db2544893d6bfb",2,"Improved Logical Reasoning of Language Models via Differentiable Symbolic Programming","DSR-LM is scalable, interpretable, and allows easy integration of prior knowledge, thereby supporting extensive symbolic programming to robustly derive a logical conclusion and leads to improved logical reasoning of pre-trained LMs.","",2022,"Hanlin Zhang,Jian-Hui Huang,Ziyang Li,M. Naik,Eric Xing",3,43,1
"fed460648303afa32247e493847e4dc73dc1a5b3","https://www.semanticscholar.org/paper/fed460648303afa32247e493847e4dc73dc1a5b3",2,"Can We Guide a Multi-Hop Reasoning Language Model to Incrementally Learn at Each Single-Hop?","To endow PLMs with incremental reasoning skills, this work proposes a set of inference strategies on relevant facts and distractors allowing us to build automatically generated training datasets, and empirically shows the effectiveness of this proposal on multiple-choice question answering and reading comprehension.","International Conference on Computational Linguistics",2022,"Jesús Lovón-Melgarejo,Jose G. Moreno,Romaric Besançon,Olivier Ferret,L. Tamine",0,36,0
"37bf0bf34603145246c3311df19e2afdf6e0270a","https://www.semanticscholar.org/paper/37bf0bf34603145246c3311df19e2afdf6e0270a",2,"JAKET: Joint Pre-training of Knowledge Graph and Language Understanding","A novel joint pre-training framework, JAKET, to model both the knowledge graph and language, which enables the pre-trained model to easily adapt to unseen knowledge graphs in new domains.","AAAI Conference on Artificial Intelligence",2020,"Donghan Yu,Chenguang Zhu,Yiming Yang,Michael Zeng",47,50,5
"a466d10b80dbdee3b130bef73ec62f3a89eb389b","https://www.semanticscholar.org/paper/a466d10b80dbdee3b130bef73ec62f3a89eb389b",2,"Enhancing Multilingual Language Model with Massive Multilingual Knowledge Triples","This work explores methods to make better use of the multilingual annotation and language agnostic property of KG triples, and presents novel knowledge based multilingual language models (KMLMs) trained directly on the knowledge triples.","Conference on Empirical Methods in Natural Language Processing",2021,"Linlin Liu,Xin Li,Ruidan He,Lidong Bing,Shafiq R. Joty,Luo Si",2,49,0
"0b483b550b21ec42d693fc04a372dbb10dd07019","https://www.semanticscholar.org/paper/0b483b550b21ec42d693fc04a372dbb10dd07019",2,"Does Pre-training Induce Systematic Inference? How Masked Language Models Acquire Commonsense Knowledge","It is found generalization does not improve over the course of pre-training, suggesting that commonsense knowledge is acquired from surface-level, co-occurrence patterns rather than induced, systematic reasoning.","North American Chapter of the Association for Computational Linguistics",2021,"Ian Porada,Alessandro Sordoni,J. C. Cheung",1,47,0
"7bebb48d34c219b119ca2d4ffc97d7fd4940c35c","https://www.semanticscholar.org/paper/7bebb48d34c219b119ca2d4ffc97d7fd4940c35c",2,"On the data requirements of probing","A novel method to estimate the required number of data samples in such experiments is presented and, across several case studies, it is verified that the estimations have sufficient statistical power.","Findings",2022,"Zining Zhu,Jixuan Wang,Bai Li,F. Rudzicz",2,66,0
"50f7d69ddd7f9b34f5121607fbdcc57236d65b8c","https://www.semanticscholar.org/paper/50f7d69ddd7f9b34f5121607fbdcc57236d65b8c",2,"Can Pre-trained Language Models Interpret Similes as Smart as Human?","This paper investigates the ability of PLMs in simile interpretation by designing a novel task named Simile Property Probing, and shows that PLMs can infer similes’ shared properties while still underperforming humans.","Annual Meeting of the Association for Computational Linguistics",2022,"Qi He,Sijie Cheng,Zhixu Li,Rui Xie,Yanghua Xiao",4,54,0
"2aba5bba16dac5cd62683bab9de5d6faaaed0de1","https://www.semanticscholar.org/paper/2aba5bba16dac5cd62683bab9de5d6faaaed0de1",2,"Shepherd Pre-trained Language Models to Develop a Train of Thought: An Iterative Prompting Approach","An iterative prompting framework, a new prompting paradigm which progressively elicits relevant knowledge from PLMs for multi-step inference tasks, and proposes an iterative context-aware prompter, which addresses limitations by learning to dynamically synthesize prompts conditioned on the current step’s contexts.","ArXiv",2022,"Boshi Wang,Xiang Deng,Huan Sun",4,44,2
"3f4d11971f2c64be9125a7fe99c019588bbebf16","https://www.semanticscholar.org/paper/3f4d11971f2c64be9125a7fe99c019588bbebf16",2,"Iteratively Prompt Pre-trained Language Models for Chain of Thought","An iterative prompting framework is explored, a new prompting paradigm which progressively elicits relevant knowledge from PLMs for multi-step inference by learning to dynamically synthesize prompts conditioned on the current step’s contexts.","Conference on Empirical Methods in Natural Language Processing",2022,"Boshi Wang,Xiang Deng,Huan Sun",4,48,3
"706c6b3781374b0b11f98f204a4ddd05b26ed009","https://www.semanticscholar.org/paper/706c6b3781374b0b11f98f204a4ddd05b26ed009",2,"Knowledge Infused Decoding","Knowledge Infused Decoding (KID)—a novel decoding algorithm for generative LMs, which dynamically infuses external knowledge into each step of the LM decoding, which maintains a local knowledge memory based on the current context, interacting with a dynamically created external knowledge trie, and continuously update the local memory as a knowledge-aware constraint to guide decoding via reinforcement learning.","International Conference on Learning Representations",2022,"Ruibo Liu,Guoqing Zheng,Shashank Gupta,Radhika Gaonkar,Chongyang Gao,Soroush Vosoughi,Milad Shokouhi,A. Awadallah",6,98,1
"cd471b5ef162906ef3d9a84398b3f98e9ee4bf56","https://www.semanticscholar.org/paper/cd471b5ef162906ef3d9a84398b3f98e9ee4bf56",2,"A Review on Language Models as Knowledge Bases","This paper presents a set of aspects that it is deemed an LM should have to fully act as a KB, and reviews the recent literature with respect to those aspects.","ArXiv",2022,"Badr AlKhamissi,Millicent Li,Asli Celikyilmaz,Mona T. Diab,Marjan Ghazvininejad",15,167,5
"e3dae33c5bdf397abdefd971ea34c48fb836dcc0","https://www.semanticscholar.org/paper/e3dae33c5bdf397abdefd971ea34c48fb836dcc0",2,"GeoMLAMA: Geo-Diverse Commonsense Probing on Multilingual Pre-Trained Language Models","Interestingly, it is found that larger multilingual PLMs variants do not necessarily store geo-diverse concepts better than its smaller variant; and a language may better probe knowledge about a non-native country than its native country.","Conference on Empirical Methods in Natural Language Processing",2022,"Da Yin,Hritik Bansal,Masoud Monajatipoor,Liunian Harold Li,Kai-Wei Chang",6,45,0
"2db6c10f135d5701ae7aec45986124ce264c1344","https://www.semanticscholar.org/paper/2db6c10f135d5701ae7aec45986124ce264c1344",2,"Learning Symbolic Rules for Reasoning in Quasi-Natural Language","This work proposes MetaQNL, a “Quasi-Natural” language that can express both formal logic and natural language sentences, and MetaInduce, a learning algorithm that inducesMetaQNL rules from training data consisting of questions and answers, with or without intermediate reasoning steps.","ArXiv",2021,"Kaiyu Yang,Jia Deng",5,74,0
"108c25905be36b2a7a0fc7256ac314985ecd9699","https://www.semanticscholar.org/paper/108c25905be36b2a7a0fc7256ac314985ecd9699",2,"Induced Natural Language Rationales and Interleaved Markup Tokens Enable Extrapolation in Large Language Models","This work demonstrates that large language models can succeed in extrapolation without modifying their architecture or training procedure, and shows how generating step-by-step rationales and introducing marker tokens are both required for effective extrapolation.","MATHNLP",2022,"M. Bueno,Carlos Gemmel,Jeffrey Stephen Dalton,R. Lotufo,Rodrigo Nogueira",1,65,0
"30977afbd4501249e1a320bd2e48581197914ab8","https://www.semanticscholar.org/paper/30977afbd4501249e1a320bd2e48581197914ab8",2,"A Short Survey of Systematic Generalization","This survey includes systematic generalization and aory of how machine learning addresses it, and looks into sys- tematic generalization in language, vision, and VQA ﬁelds.","ArXiv",2022,"Yuanpeng Li",0,241,0
"3d2035edd4dd48e1e638279409e11bf689c461e1","https://www.semanticscholar.org/paper/3d2035edd4dd48e1e638279409e11bf689c461e1",2,"Temporal Reasoning in Natural Language Inference","Five new natural language inference (NLI) datasets focused on temporal reasoning are introduced and four existing datasets annotated for event duration and event ordering are recast into more than one million NLI examples.","Findings",2020,"Siddharth Vashishtha,Adam Poliak,Yash Kumar Lal,Benjamin Van Durme,Aaron Steven White",20,60,3
"d865c87f6ce4e0be29ae1e3780fae66b8034d04b","https://www.semanticscholar.org/paper/d865c87f6ce4e0be29ae1e3780fae66b8034d04b",2,"TR at SemEval-2020 Task 4: Exploring the Limits of Language-model-based Common Sense Validation","This paper examines the ability of large-scale pre-trained language models to distinguish commonsense from non-commonsense statements, and the utility of external resources that aim to supplement the world knowledge inherent in such language models, including commonsense knowledge graph embedding models, word concreteness ratings, and text-to-image generation models.","International Workshop on Semantic Evaluation",2020,"Don Teo",2,54,0
"9793b07ba09d9f2ac9cabd8117daa93bf3db4346","https://www.semanticscholar.org/paper/9793b07ba09d9f2ac9cabd8117daa93bf3db4346",2,"DEER: A Data Efficient Language Model for Event Temporal Reasoning","This work proposes DEER, a language model that is trained to focus on event temporal relations and performs better under low-resource settings than original LMs and uses a generator-discriminator structure to reinforce the LMs' capability of event temporal reasoning.","ArXiv",2020,"Rujun Han,Xiang Ren,Nanyun Peng",11,16,1
"e6d84cf9ae6efa10919bff765613e883a761db62","https://www.semanticscholar.org/paper/e6d84cf9ae6efa10919bff765613e883a761db62",2,"Open Temporal Relation Extraction for Question Answering","This paper decomposes each question into a question event and an open temporal relation (OTR) which is not pre-defined nor with timestamps, and ground the former in the context while sharing the representation of the latter across contexts.","Conference on Automated Knowledge Base Construction",2021,"Chao Shang,Peng Qi,Guangtao Wang,Jing Huang,Youzheng Wu,Bowen Zhou",2,25,0
"6bb369f874f49cd51415f216f1a3f635f2ca1eed","https://www.semanticscholar.org/paper/6bb369f874f49cd51415f216f1a3f635f2ca1eed",2,"ESTER: A Machine Reading Comprehension Dataset for Reasoning about Event Semantic Relations","","Conference on Empirical Methods in Natural Language Processing",2021,"Rujun Han,I-Hung Hsu,Jiao Sun,J. Baylón,Qiang Ning,D. Roth,Nanyun Peng",13,36,2
"30602e3382df3abedb5f225b55b7efce8580f74d","https://www.semanticscholar.org/paper/30602e3382df3abedb5f225b55b7efce8580f74d",2,"ForecastQA: A Question Answering Challenge for Event Forecasting with Temporal Text Data","This work aims to formulate a task, construct a dataset, and provide benchmarks for developing methods for event forecasting with large volumes of unstructured text data, and introduces ForecastQA, a question-answering dataset consisting of 10,392 event forecasting questions, which have been collected and verified via crowdsourcing efforts.","Annual Meeting of the Association for Computational Linguistics",2020,"Woojeong Jin,Suji Kim,Rahul Khanna,Dong-Ho Lee,Fred Morstatter,A. Galstyan,Xiang Ren",12,59,1
"9d436d25981ea61db728bd490f0d54376d08953e","https://www.semanticscholar.org/paper/9d436d25981ea61db728bd490f0d54376d08953e",2,"Temporal Reasoning on Implicit Events from Distant Supervision","A neuro-symbolic temporal reasoning model, SymTime, is proposed, which exploits distant supervision signals from large-scale text and uses temporal rules to combine start times and durations to infer end times and generalizes to other temporal reasoning tasks.","North American Chapter of the Association for Computational Linguistics",2020,"Ben Zhou,Kyle Richardson,Qiang Ning,Tushar Khot,Ashish Sabharwal,D. Roth",36,55,6
"6eee69031d2e11aa03a5a8fcb219cff4562863be","https://www.semanticscholar.org/paper/6eee69031d2e11aa03a5a8fcb219cff4562863be",2,"ECONET: Effective Continual Pretraining of Language Models for Event Temporal Reasoning","A continual pre-training approach that equips PTLMs with targeted knowledge about event temporal relations and design self-supervised learning objectives to recover masked-out event and temporal indicators and to discriminate sentences from their corrupted counterparts.","Conference on Empirical Methods in Natural Language Processing",2020,"Rujun Han,Xiang Ren,Nanyun Peng",12,38,3
"33b06c74eea3f400b6f5ef14ef163aef1db42d16","https://www.semanticscholar.org/paper/33b06c74eea3f400b6f5ef14ef163aef1db42d16",2,"Conditional Generation of Temporally-ordered Event Sequences","A single model is proposed that addresses both temporal ordering, sorting given events into the order they occurred, and event infilling, predicting new events which fit into an existing temporally-ordered sequence.","Annual Meeting of the Association for Computational Linguistics",2020,"Shih-Ting Lin,Nathanael Chambers,Greg Durrett",10,63,2
"d6c919ee0d51432496513ef4b6b2dbd128819779","https://www.semanticscholar.org/paper/d6c919ee0d51432496513ef4b6b2dbd128819779",2,"Microtask Detection","This article introduces the novel challenge of microtask detection, and it presents machine-learned models for automatically determining which tasks are actionable and which of these actionable tasks are microtasks, which have implications for the design of systems to help people make the most of their time.","ACM Trans. Inf. Syst.",2021,"Ryen W. White,E. Nouri,James Woffinden-Luey,Mark J. Encarnación,S. Jauhar",4,149,0
"c5943bc4b22a63f595cb1c2823a449e03aad4787","https://www.semanticscholar.org/paper/c5943bc4b22a63f595cb1c2823a449e03aad4787",2,"AR-LSAT: Investigating Analytical Reasoning of Text","This paper studies the challenge of analytical reasoning of text and introduces a new dataset consisting of questions from the Law School Admission Test from 1991 to 2016, and designs two different baselines which struggle to solve this task.","ArXiv",2021,"Wanjun Zhong,Siyuan Wang,Duyu Tang,Zenan Xu,Daya Guo,Jiahai Wang,Jian Yin,Ming Zhou,Nan Duan",8,43,0
"2ef4be35f8424ea768aa2e1b44392b3eddbc780b","https://www.semanticscholar.org/paper/2ef4be35f8424ea768aa2e1b44392b3eddbc780b",2,"Back to Square One: Artifact Detection, Training and Commonsense Disentanglement in the Winograd Schema","It is suggested that the apparent progress on WS may not necessarily reflect progress in commonsense reasoning, and the observed progress is mostly due to the use of supervision in training WS models, which is not likely to successfully support all the required Commonsense reasoning skills and knowledge.","Conference on Empirical Methods in Natural Language Processing",2021,"Yanai Elazar,Hongming Zhang,Yoav Goldberg,D. Roth",27,74,2
"c7f977f556d2060238fdc1286d057d46958afaf9","https://www.semanticscholar.org/paper/c7f977f556d2060238fdc1286d057d46958afaf9",2,"ESTER: A Machine Reading Comprehension Dataset for Event Semantic Relation Reasoning","ESTER, a comprehensive machine reading comprehension (MRC) dataset for Event Semantic Relation Reasoning is introduced, which study five most commonly used event semantic relations and formulate them as questionanswering tasks.","ArXiv",2021,"Rujun Han,I-Hung Hsu,Jiao Sun,J. Baylón,Qiang Ning,D. Roth,Nanyun Pen",5,38,2
"7fa273f450251523e6b7fcc2eb3fdbdfd4a30493","https://www.semanticscholar.org/paper/7fa273f450251523e6b7fcc2eb3fdbdfd4a30493",2,"CrossFit: A Few-shot Learning Challenge for Cross-task Generalization in NLP","This paper presents the NLP Few-shot Gym, a repository of 160 diverse few-shot NLP tasks created from open-access NLP datasets and converted to a unified text-to-text format, and reveals that the few- shot learning ability on unseen tasks can be improved via an upstream learning stage using a set of seen tasks.","Conference on Empirical Methods in Natural Language Processing",2021,"Qinyuan Ye,Bill Yuchen Lin,Xiang Ren",69,176,18
"174a0e6da0dfb7f96d4a0a4076eed154c439e41a","https://www.semanticscholar.org/paper/174a0e6da0dfb7f96d4a0a4076eed154c439e41a",2,"Probing Language Models for Understanding of Temporal Expressions","It is found that although large language models fine-tuned on MNLI have some basic perception of the order between points in time, at large, these models do not have a thorough understanding of the relation between temporal expressions.","BlackboxNLP Workshop on Analyzing and Interpreting Neural Networks for NLP",2021,"Shivin Thukral,Kunal Kukreja,Christian Kavouras",4,29,1
"d83c7aa12420d5d035f43d7737bfa6893e9e2c61","https://www.semanticscholar.org/paper/d83c7aa12420d5d035f43d7737bfa6893e9e2c61",2,"Exploring Universal Intrinsic Task Subspace via Prompt Tuning","Evidence is shown indicating that the adaptations of PLMs to various few-shot tasks can be reparameterized as optimizing only a few free parameters in a low-dimensional intrinsic task subspace, which may help to understand why PLMs could easily adapt to various NLP tasks with small-scale data.","",2021,"Yujia Qin,Xiaozhi Wang,Yusheng Su,Yankai Lin,Ning Ding,Jing Yi,Weize Chen,Zhiyuan Liu,Juanzi Li,Lei Hou,Peng Li,Maosong Sun,Jie Zhou",2,125,0
"b672d2ec81c9395c312d57a27931864d07664592","https://www.semanticscholar.org/paper/b672d2ec81c9395c312d57a27931864d07664592",2,"A Meta-framework for Spatiotemporal Quantity Extraction from Text","This paper formulates the NLP problem of spatiotemporal quantity extraction, and proposes the first meta-framework for solving it, which contains a formalism that decomposes the problem into several information extraction tasks, a shareable crowdsourcing pipeline, and transformer-based baseline models.","Annual Meeting of the Association for Computational Linguistics",2022,"Qiang Ning,Ben Zhou,Hao Wu,Haoruo Peng,Chuchu Fan,Matt Gardner",0,50,0
