"id","url","score","title","summary","venue","year","authors","citationCount","referenceCount","influentialCitationCount"
"7db7fb25a8753c9efc6b3722d178f94fcc1f82d3","https://www.semanticscholar.org/paper/7db7fb25a8753c9efc6b3722d178f94fcc1f82d3",2,"KnowDA: All-in-One Knowledge Mixture Model for Data Augmentation in Few-Shot NLP","It is demonstrated that the proposed Knowledge Mixture enables pre-trained language models the capability of generating proper synthetic instances from scratch for complicated tasks (i.e., the data sample has long sequences or multiple sentences).","ArXiv",2022,"Yufei Wang,Jiayi Zheng,Can Xu,Xiubo Geng,Tao Shen,Chongyang Tao,Daxin Jiang",0,118,0
"82c6f5ffd4d2d43ae7684601f607eae26a759a5a","https://www.semanticscholar.org/paper/82c6f5ffd4d2d43ae7684601f607eae26a759a5a",2,"Analytical Reasoning of Text","This paper studies the challenge of analytical reasoning of text and collects a new dataset consisting of questions from the Law School Admission Test from 1991 to 2016, and presents an approach dubbed ARM, which outperforms pre-trained models significantly.","NAACL-HLT",2022,"Wanjun Zhong,Siyuan Wang,Duyu Tang,Zenan Xu,Daya Guo,Yining Chen,Jiahai Wang,Jian Yin,Ming Zhou,Nan Duan",0,55,0
"b8768fbba4d356a1c49dcd8e4cd33aea0c6472bc","https://www.semanticscholar.org/paper/b8768fbba4d356a1c49dcd8e4cd33aea0c6472bc",2,"How about Time? Probing a Multilingual Language Model for Temporal Relations","This paper presents a comprehensive set of probing experiments using a multilingual language model, XLM-R, for temporal relation classification between events in four languages, and results show an advantage of contextualized embeddings over static ones and a detrimen- tal role of sentence level embeddeddings.","International Conference on Computational Linguistics",2022,"Tommaso Caselli,Irene Dini,F. Dell’Orletta",0,39,0
"8b0b5b998d65add5c036b45c36afa3f9df96f4b0","https://www.semanticscholar.org/paper/8b0b5b998d65add5c036b45c36afa3f9df96f4b0",2,"Toward Building a Language Model for Understanding Temporal Commonsense","This paper focuses on the development of language models for temporal commonsense inference over several pre-trained language models, and relies on multi-step fine-tuning using multiple corpora, and masked language modeling to predict masked temporal indicators that are crucial for temporal Commonsense reasoning.","AACL",2022,"Mayuko Kimura,L. Pereira,Ichiro Kobayashi",0,24,0
"9cd0cb3af7c2215eae9afdcf500a2bcd5330aae3","https://www.semanticscholar.org/paper/9cd0cb3af7c2215eae9afdcf500a2bcd5330aae3",2,"20Q: Overlap-Free World Knowledge Benchmark for Language Models","20Q is introduced, a novel benchmark using the Twenty Questions game to evaluate world knowledge and common sense of language models and shows that in-context learning is inefficient for evaluating language models’ world knowledge — fine-tuning is necessary to show their true capabilities.","IEEE Games Entertainment Media Conference",2022,"Maxime De Bruyn,Ehsan Lotfi,Jeska Buhmann,Walter Daelemans",0,36,0
"cbdb45fc16b0885905b91d84281c310e6cb49e9c","https://www.semanticscholar.org/paper/cbdb45fc16b0885905b91d84281c310e6cb49e9c",2,"Cross-Task Generalization via Natural Language Crowdsourcing Instructions","This work introduces NATURAL INSTRUCTIONS, a dataset of 61 distinct tasks, their human-authored instructions, and 193k task instances, and adopts generative pre-trained language models to encode task-specific instructions along with input and generate task output.","Annual Meeting of the Association for Computational Linguistics",2021,"Swaroop Mishra,Daniel Khashabi,Chitta Baral,Hannaneh Hajishirzi",115,54,15
"ac8d33e4c0a45e227a47353f3f26fbb231482dc1","https://www.semanticscholar.org/paper/ac8d33e4c0a45e227a47353f3f26fbb231482dc1",2,"Time-Aware Language Models as Temporal Knowledge Bases","This work proposes a simple technique for jointly modeling text with its timestamp that improves memorization of seen facts from the training time period, as well as calibration on predictions about unseen facts from future time periods and shows that models trained with temporal context can be efficiently ""refreshed"" as new data arrives.","International Conference on Topology, Algebra and Categories in Logic",2021,"Bhuwan Dhingra,Jeremy R. Cole,Julian Martin Eisenschlos,D. Gillick,Jacob Eisenstein,William W. Cohen",64,54,13
"47df3fd32d00220c85c2c51a571254fd99b2ecc7","https://www.semanticscholar.org/paper/47df3fd32d00220c85c2c51a571254fd99b2ecc7",2,"MetaICL: Learning to Learn In Context","This work introduces MetaICL (Meta-training for In-Context Learning), a new meta-training framework for few-shot learning where a pretrained language model is tuned to do in-context learning on a large set of training tasks.","North American Chapter of the Association for Computational Linguistics",2021,"Sewon Min,M. Lewis,Luke Zettlemoyer,Hannaneh Hajishirzi",76,136,18
"c3a454e50ec0610f1380d55b1988a5eb5d45207b","https://www.semanticscholar.org/paper/c3a454e50ec0610f1380d55b1988a5eb5d45207b",2,"Zero-shot Commonsense Question Answering with Cloze Translation and Consistency Optimization","Four translation methods that can translate natural questions into cloze-style sentences to better solicit commonsense knowledge from language models are investigated, including a syntactic-based model, an unsupervised neural model, and two supervised neural models.","AAAI Conference on Artificial Intelligence",2022,"Zi-Yi Dou,Nanyun Peng",7,43,1
"7e5ca499cd9b932921bda84db98f75087d0b0683","https://www.semanticscholar.org/paper/7e5ca499cd9b932921bda84db98f75087d0b0683",2,"Commonsense Knowledge Reasoning and Generation with Pre-trained Language Models: A Survey","A survey of commonsense knowledge acquisition and reasoning tasks, the strengths and weaknesses of state-of-the-art pre-trained models for commonsense reasoning and generation as revealed by these tasks, and reflects on future research directions are presented.","AAAI Conference on Artificial Intelligence",2022,"Prajjwal Bhargava,Vincent Ng",9,82,0
"078f4efd448822b0e25d3ee0aec842ced606a595","https://www.semanticscholar.org/paper/078f4efd448822b0e25d3ee0aec842ced606a595",2,"Go Back in Time: Generating Flashbacks in Stories with Event Temporal Prompts","A Plan-and-Write framework enhanced by reinforcement learning to generate storylines and stories end-to-end using structured storylines to encode events and their pair-wise temporal relations as **temporal prompts** that guide how stories should unfold temporally.","North American Chapter of the Association for Computational Linguistics",2022,"Rujun Han,Hong Chen,Yufei Tian,Nanyun Peng",5,50,0
"e852c5ed7f4f1a4375f0f3bce1b4e445c7684e7e","https://www.semanticscholar.org/paper/e852c5ed7f4f1a4375f0f3bce1b4e445c7684e7e",2,"KnowDA: All-in-One Knowledge Mixture Model for Data Augmentation in Low-Resource NLP","The goal of KoMT is to condense diverse NLP task-speciﬁc knowledge into the single KnowDA model (i.e., all-in-one) such that KnowDA could utilize these knowledge to quickly grasp the inherent synthesis law of the target task through limited training instances.","",2022,"Yufei Wang,Jiayi Zheng,Can Xu,Xiubo Geng,Tao Shen,Chongyang Tao,Daxin Jiang",0,117,0
"98f19ca97512361b12475b42b67a617de14d33a1","https://www.semanticscholar.org/paper/98f19ca97512361b12475b42b67a617de14d33a1",2,"Mitigating Reporting Bias in Semi-supervised Temporal Commonsense Inference with Probabilistic Soft Logic","A novel neural-logic based Soft Logic Enhanced Event Temporal Reasoning (SLEER) model is proposed for acquiring unbiased TCS knowledge, in which the complementary relationship among dimensions are explicitly represented as logic rules and modeled by t-norm fuzzy logics.","AAAI Conference on Artificial Intelligence",2022,"Bibo Cai,Xiao Ding,Bowen Chen,L. Du,Ting Liu",0,36,0
"15bacb240e2598457af4ded3039b6988aa9706f0","https://www.semanticscholar.org/paper/15bacb240e2598457af4ded3039b6988aa9706f0",2,"Few-shot Adaptation Works with UnpredicTable Data","This work automatically extracting 413,299 tasks from internet tables - orders of magnitude more than the next-largest public datasets - and finds that narrow subsets of the authors' dataset sometimes outperform more diverse datasets.","ArXiv",2022,"Jun Shern Chan,M. Pieler,Jonathan Jao,J. Scheurer,Ethan Perez",2,144,0
"9a3f1a51ab2b3816655e4c4f58a022421ea7b34b","https://www.semanticscholar.org/paper/9a3f1a51ab2b3816655e4c4f58a022421ea7b34b",2,"""John is 50 years old, can his son be 65?"" Evaluating NLP Models' Understanding of Feasibility","This work introduces FeasibilityQA, a question-answering dataset involving binary classification (BCQ) and multi-choice multi-correct questions (MCQ) that test understanding of feasibility, and shows that even state-of-the-art models such as GPT-3, G PT-2, and T5 struggle to answer the feasibility questions correctly.","ArXiv",2022,"Himanshu Gupta,Neeraj Varshney,Swaroop Mishra,Kuntal Kumar Pal,Saurabh Arjun Sawant,Kevin Scaria,Siddharth Goyal,Chitta Baral",1,44,0
"1d417bdd331912a458de920459f23fcc7f6e8699","https://www.semanticscholar.org/paper/1d417bdd331912a458de920459f23fcc7f6e8699",2,"Learning to Decompose: Hypothetical Question Decomposition Based on Comparable Texts","It is shown that with such intermediate pre-training, developing robust decomposition-based models for a diverse range of tasks becomes more feasible, and the model, DecompT5, improves 20% to 30% on two datasets, Overnight and TORQUE, over the baseline language model.","Conference on Empirical Methods in Natural Language Processing",2022,"Ben Zhou,Kyle Richardson,Xiaodong Yu,D. Roth",3,38,0
"1eba9c79a7064a7e04bd387767f87b9f891472e2","https://www.semanticscholar.org/paper/1eba9c79a7064a7e04bd387767f87b9f891472e2",2,"Test of Time: Instilling Video-Language Models with a Sense of Time","This paper proposes a temporal adaptation recipe on top of one video-language model, VideoCLIP, based on post-pretraining on a small amount of video-text data, and conducts a zero-shot evaluation of the adapted models on six datasets for three downstream tasks which require a varying degree of time awareness.","ArXiv",2023,"Piyush Bagad,Makarand Tapaswi,Cees G. M. Snoek",0,127,0
"a7e23ffb6c692e54c1fc138a2690e06a56da14ee","https://www.semanticscholar.org/paper/a7e23ffb6c692e54c1fc138a2690e06a56da14ee",2,"tieval: An Evaluation Framework for Temporal Information Extraction Systems","T tieval, a Python library that provides a concise interface for importing different corpora and is equipped with domain-specific operations that facilitate system evaluation, is presented and its most relevant features are highlighted.","ArXiv",2023,"Hugo Sousa,A. Jorge,Ricardo Campos",0,35,0
"72c47862e2eee0e65bc25b6cd6baeb2a50ef4bc7","https://www.semanticscholar.org/paper/72c47862e2eee0e65bc25b6cd6baeb2a50ef4bc7",2,"tasksource: Structured Dataset Preprocessing Annotations for Frictionless Extreme Multi-Task Learning and Evaluation","This work identifies patterns across previous preprocessings, e.g. mapping of column names, and extraction of a specific sub-field from structured data in a column, and proposes a structured annotation framework that makes the authors' annotations fully exposed and not buried in unstructured code.","ArXiv",2023,"Damien Sileo",0,145,0
"9574d10f55e77d432f923ee71e3205fc64a3104a","https://www.semanticscholar.org/paper/9574d10f55e77d432f923ee71e3205fc64a3104a",2,"Learning to Initialize: Can Meta Learning Improve Cross-task Generalization in Prompt Tuning?","Meta prompt tuning is studied to systematically explore how meta-learning can help improve (if it can) cross-task generalization in PT through learning to initialize the prompt embeddings from other relevant tasks and an in-depth analysis from the perspective of task similarity.","",2023,"Chengwei Qin,Shafiq R. Joty,Q. Li,Ruochen Zhao",0,161,0
"40a1f266bb5ca853837355bfff272a55f0049c81","https://www.semanticscholar.org/paper/40a1f266bb5ca853837355bfff272a55f0049c81",2,"Mining Numbers in Text: A Survey","A quick overview of the history and recent advances of the research of mining such relations between numerals and words found in text data is provided.","Information Systems",2021,"Minoru Yoshida,K. Kita",2,47,0
"320c1c6647a5b975c901347f71638c881888686b","https://www.semanticscholar.org/paper/320c1c6647a5b975c901347f71638c881888686b",2,"NQuAD: 70,000+ Questions for Machine Comprehension of the Numerals in Text","A Numeral-related Question Answering Dataset, NQuAD, for fine-grained numeracy, is presented, and several baselines for future works are proposed and it is shown that N QuAD is more challenging than the numeral- related questions in other datasets.","International Conference on Information and Knowledge Management",2021,"Chung-Chi Chen,Hen-Hsen Huang,Hsin-Hsi Chen",0,28,0
"251c3afbaafcc9b5178534be9109f644bfc5e912","https://www.semanticscholar.org/paper/251c3afbaafcc9b5178534be9109f644bfc5e912",2,"Enhancing Knowledge Bases with Quantity Facts","A recall-oriented approach to close the gap in knowledge-base coverage, based on iterative learning for extracting quantity facts, with two novel contributions to boost recall for KB augmentation without sacrificing the quality standards of the knowledge base.","The Web Conference",2022,"Vinh Thinh Ho,D. Stepanova,Dragan Milchevski,Jannik Strötgen,G. Weikum",2,48,0
"237f5ca6fcccef2b77a2212b34fb06a1dbd09b72","https://www.semanticscholar.org/paper/237f5ca6fcccef2b77a2212b34fb06a1dbd09b72",2,"Evaluating Prompts Across Multiple Choice Tasks In a Zero-Shot Setting","Collect and standardize prompts from a diverse range of tasks for use with tasks they were not designed for and evaluate these prompts across multiple choice datasets for a quantitative analysis of how certain attributes of a prompt affect performance.","ArXiv",2022,"Gabriel Orlanski",0,47,0
"75e17a2dc0a2b2c1cce5ab89d8c703fb8bddbef1","https://www.semanticscholar.org/paper/75e17a2dc0a2b2c1cce5ab89d8c703fb8bddbef1",2,"On the Computational Power of Transformers and Its Implications in Sequence Modeling","This paper provides an alternate and simpler proof to show that vanilla Transformers are Turing-complete and proves that Transformers with only positional masking and without any positional encoding are also Turing- complete.","Conference on Computational Natural Language Learning",2020,"S. Bhattamishra,Arkil Patel,Navin Goyal",19,41,4
"c2b4d96db34bd472e84c9234838cc4e808eb1ba9","https://www.semanticscholar.org/paper/c2b4d96db34bd472e84c9234838cc4e808eb1ba9",2,"Neuro-Symbolic Representations for Video Captioning: A Case for Leveraging Inductive Biases for Vision and Language","A new model architecture for learning multi-modal neuro-symbolic representations for video captioning using a dictionary learning-based method that incorporates modality-specific inductive biases for the captioning task is proposed.","ArXiv",2020,"Hassan Akbari,H. Palangi,Jianwei Yang,Sudha Rao,Asli Celikyilmaz,Roland Fernandez,P. Smolensky,Jianfeng Gao,Shih-Fu Chang",2,81,0
"ac4ae352e2434d4a71c6a79bf5f93df5f600b058","https://www.semanticscholar.org/paper/ac4ae352e2434d4a71c6a79bf5f93df5f600b058",2,"Increasing Learning Efficiency of Self-Attention Networks through Direct Position Interactions, Learnable Temperature, and Convoluted Attention","This work investigates three modifications to SANs: direct position interactions, learnable temperature, and convoluted attention that enable faster learning, i.e., higher accuracies after fewer update steps.","International Conference on Computational Linguistics",2020,"Philipp Dufter,Martin Schmitt,Hinrich Schütze",3,27,0
"89bc3b21c15c0656643918488ea25af939d0881a","https://www.semanticscholar.org/paper/89bc3b21c15c0656643918488ea25af939d0881a",2,"MuseMorphose: Full-Song and Fine-Grained Music Style Transfer with Just One Transformer VAE","Experiments show that MuseMorphose outperforms recurrent neural network (RNN) based baselines on numerous widely-used metrics for style transfer tasks.","ArXiv",2021,"Shih-Lun Wu,Yi-Hsuan Yang",20,79,1
"976a609cf540d1ded373b872d34779f7164d840a","https://www.semanticscholar.org/paper/976a609cf540d1ded373b872d34779f7164d840a",2,"Rethinking the Design Principles of Robust Vision Transformer","RVT is a new vision transformer, which has superior performance and strong robustness, and two new plug-and-play techniques called position-aware attention rescaling and patch-wise augmentation to train the authors' RVT are proposed.","",2021,"Xiaofeng Mao,Gege Qi,Yuefeng Chen,Xiaodan Li,Shaokai Ye,Yuan He,Hui Xue",17,39,0
"52d01d9f71caf0d021fccb75b75b7d3dfc7460f5","https://www.semanticscholar.org/paper/52d01d9f71caf0d021fccb75b75b7d3dfc7460f5",2,"On Scalar Embedding of Relative Positions in Attention Models","This work shows that SRPE in attention has an elegant probabilistic interpretation and proposes a new SRPE (AT5) that adopts a learnable bucketization protocol and automatically adapts to the dependency range specific to the learning task.","AAAI Conference on Artificial Intelligence",2021,"Junshuang Wu,Richong Zhang,Yongyi Mao,Junfan Chen",2,21,0
"a28861bdef17182df3b64fc99e9359e2e23e7672","https://www.semanticscholar.org/paper/a28861bdef17182df3b64fc99e9359e2e23e7672",2,"Transformer with Syntactic Position Encoding for Machine Translation","This work proposes global positional encoding for dependency tree, a new scheme that facilitates syntactic relation modeling between any two words with keeping exactness and without immediate neighbor constraint, which is more effective than existing approaches.","Recent Advances in Natural Language Processing",2021,"Yikuan Xie,Wenyong Wang,Mingqian Du,Qing He",0,28,0
"8babeaffc8413747412765803a50d2c3adbbbbdd","https://www.semanticscholar.org/paper/8babeaffc8413747412765803a50d2c3adbbbbdd",2,"DEBERTA: DECODING-ENHANCED BERT","A new model architecture DeBERTa (Decoding-enhanced BERT with disentangled attention) is proposed that improves the BERT and RoBERTa models using two novel techniques that significantly improve the efficiency of model pre-training and the performance of both natural language understand (NLU) and natural langauge generation (NLG) downstream tasks.","",2021,"Pengcheng He,Xiaodong Liu,Jianfeng Gao,Weizhu Chen",0,61,0
"8d6b1929b92211ad0eb3e14b2c2b41789ccf053a","https://www.semanticscholar.org/paper/8d6b1929b92211ad0eb3e14b2c2b41789ccf053a",2,"Explore Better Relative Position Embeddings from Encoding Perspective for Transformer Models","This paper investigates the potential problems in Shaw-R PE and XL-RPE, and proposes two novel RPEs called Low-level Fine-grained High-level Coarse- grained (LFHC) RPE and Gaussian Cumulative Distribution Function (GCDF) R PE.","Conference on Empirical Methods in Natural Language Processing",2021,"Anlin Qu,Jianwei Niu,Shasha Mo",3,33,0
"2a405483796dfedf5d95483aa8880c57626e0e9f","https://www.semanticscholar.org/paper/2a405483796dfedf5d95483aa8880c57626e0e9f",2,"Integrating Tree Path in Transformer for Code Representation","This paper investigates two representative path encoding methods shown in previous research work and integrates them into the attention module of Transformer, leading to the novel state-of-theart representation model TPTrans, which finally outperforms strong baselines.","Neural Information Processing Systems",2021,"Han Peng,Ge Li,Wenhan Wang,Yunfei Zhao,Zhi Jin",15,34,1
"c687acfeaafb86ab045f9fcbb6e2ff691827a0c2","https://www.semanticscholar.org/paper/c687acfeaafb86ab045f9fcbb6e2ff691827a0c2",2,"On Position Embeddings in BERT O N P OSITION E MBEDDINGS IN BERT","","",2021,"Jakob Grue",0,35,0
"05f5f8b2065a520846d89771ebaea2bb1534e9c6","https://www.semanticscholar.org/paper/05f5f8b2065a520846d89771ebaea2bb1534e9c6",2,"DeBERTa: Decoding-enhanced BERT with Disentangled Attention","A new model architecture DeBERTa (Decoding-enhanced BERT with disentangled attention) is proposed that improves the BERT and RoBERTa models using two novel techniques that significantly improve the efficiency of model pre-training and performance of downstream tasks.","International Conference on Learning Representations",2020,"Pengcheng He,Xiaodong Liu,Jianfeng Gao,Weizhu Chen",722,64,183
"787119e3c3f819244c82b7d97779473773e60696","https://www.semanticscholar.org/paper/787119e3c3f819244c82b7d97779473773e60696",2,"MaX-DeepLab: End-to-End Panoptic Segmentation with Mask Transformers","MaX-DeepLab, the first end-to-end model for panoptic segmentation, is presented, and shows a significant 7.1% PQ gain in the box-free regime on the challenging COCO dataset, closing the gap between box-based and box- free methods for the first time.","Computer Vision and Pattern Recognition",2020,"Huiyu Wang,Yukun Zhu,Hartwig Adam,A. Yuille,Liang-Chieh Chen",247,112,17
"0822f8d7e6a72a65e65f147d3a8d8fccd485da40","https://www.semanticscholar.org/paper/0822f8d7e6a72a65e65f147d3a8d8fccd485da40",2,"Shortformer: Better Language Modeling using Shorter Inputs","This work identifies conditions where shorter inputs are not harmful, and achieves perplexity and efficiency improvements through two new methods that decrease input length, and shows how to improve the efficiency of recurrence methods in transformers.","Annual Meeting of the Association for Computational Linguistics",2021,"Ofir Press,Noah A. Smith,M. Lewis",38,24,7
"f5a2ce064ea0efc3d7f26acd91041824c3254cd8","https://www.semanticscholar.org/paper/f5a2ce064ea0efc3d7f26acd91041824c3254cd8",2,"NRTSI: Non-Recurrent Time Series Imputation for Irregularly-sampled Data","This work views the imputation task from the perspective of permutation equivariant modeling of sets and proposes a novel imputation model called NRTSI without any recurrent modules, which achieves state-of-the-art performance across a wide range of commonly used time series imputation benchmarks.","ArXiv",2021,"Siyuan Shan,Junier B. Oliva",1,44,0
"594db112d65891fbaf45b27f17d2f9de88ddcd82","https://www.semanticscholar.org/paper/594db112d65891fbaf45b27f17d2f9de88ddcd82",2,"Revisiting Language Encoding in Learning Multilingual Representations","This paper revisits the use of language embedding and identifies several problems in the existing formulations and proposes a new approach called Cross-lingual Language Projection (XLP), which achieves the purpose of appropriately encoding “language” in a multilingual Transformer model.","ArXiv",2021,"Shengjie Luo,Kaiyuan Gao,Shuxin Zheng,Guolin Ke,Di He,Liwei Wang,Tie-Yan Liu",2,39,0
"eaa88d697f92739f3569564329e9d037aabbe2d7","https://www.semanticscholar.org/paper/eaa88d697f92739f3569564329e9d037aabbe2d7",2,"A Minimalist Dataset for Systematic Generalization of Perception, Syntax, and Semantics","Models show a gap toward human-level generalization when tested with new concepts in a few-shot setting, and the results suggest that current models still struggle in extrapolation to long-range syntactic dependency and semantics.","",2021,"Qing Li,Siyuan Huang,Yining Hong,Yixin Zhu,Y. Wu,Song-Chun Zhu",1,105,1
"a1ad15d2333cf9d9b55bbc97a3aacd244a8b9fdf","https://www.semanticscholar.org/paper/a1ad15d2333cf9d9b55bbc97a3aacd244a8b9fdf",2,"Demystifying the Better Performance of Position Encoding Variants for Transformer","This work demonstrates a simple yet effective way to encode position and segment into the Transformer models and performs on par with SOTA on GLUE, XTREME and WMT benchmarks while saving computation costs.","ArXiv",2021,"Pu-Chin Chen,Henry Tsai,Srinadh Bhojanapalli,Hyung Won Chung,Yin-Wen Chang,Chun-Sung Ferng",6,22,1
"db46b0de44c5113c47f0ec5392eb91d0726497bf","https://www.semanticscholar.org/paper/db46b0de44c5113c47f0ec5392eb91d0726497bf",2,"A Simple and Effective Positional Encoding for Transformers","This work introduces Decoupled Positional Attention for Transformers (DIET), a simple yet effective mechanism to encode position and segment information into the Transformer models that has faster training and inference time, while achieving competitive performance on GLUE, XTREME and WMT benchmarks.","Conference on Empirical Methods in Natural Language Processing",2021,"Pu-Chin Chen,Henry Tsai,Srinadh Bhojanapalli,Hyung Won Chung,Yin-Wen Chang,Chun-Sung Ferng",10,22,1
"66c10bf1f11bc1b2d92204d8f8391d087f6de1c4","https://www.semanticscholar.org/paper/66c10bf1f11bc1b2d92204d8f8391d087f6de1c4",2,"RoFormer: Enhanced Transformer with Rotary Position Embedding","This paper investigates various methods to integrate positional information into the learning process of transformer-based language models and proposes a novel method named Rotary Position Embedding (RoPE), which encodes the absolute position with a rotation matrix and meanwhile incorporates the explicit relative position dependency in self-attention formulation.","ArXiv",2021,"Jianlin Su,Yu Lu,Shengfeng Pan,Bo Wen,Yunfeng Liu",134,45,23
"fda805c6e85a03d10549acdc5489420ca8f3d405","https://www.semanticscholar.org/paper/fda805c6e85a03d10549acdc5489420ca8f3d405",2,"MuseMorphose: Full-Song and Fine-Grained Piano Music Style Transfer with One Transformer VAE","Experiments show that MuseMorphose outperforms recurrent neural network based baselines on numerous widely-used metrics for style transfer tasks, and is interested in bringing the two together to construct a single model that exhibits both strengths.","",2021,"Shih-Lun Wu,Yi-Hsuan Yang",0,68,0
"08ffdec40291a2ccb5f8a6cc048b01247fb34b96","https://www.semanticscholar.org/paper/08ffdec40291a2ccb5f8a6cc048b01247fb34b96",2,"Relative Positional Encoding for Transformers with Linear Complexity","Stochastic Positional Encoding is presented as a way to generate PE that can be used as a replace-ment to the classical additive (sinusoidal) PE and provably behaves like RPE.","International Conference on Machine Learning",2021,"A. Liutkus,Ondřej Cífka,Shih-Lun Wu,Umut Simsekli,Yi-Hsuan Yang,Gaël Richard",21,70,4
