"id","url","score","title","summary","venue","year","authors","citationCount","referenceCount","influentialCitationCount"
"d8e7bad2681ce70277c900c77a22181d4b03d705","https://www.semanticscholar.org/paper/d8e7bad2681ce70277c900c77a22181d4b03d705",2,"The Case for Translation-Invariant Self-Attention in Transformer-Based Language Models","Analysis of position embeddings of existing language models finds strong evidence of translation invariance, which leads to translation-invariant self-attention (TISA), which accounts for the relative position between tokens in an interpretable fashion without needing conventional position embedDings.","Annual Meeting of the Association for Computational Linguistics",2021,"Ulme Wennberg,G. Henter",8,31,1
"7509c66a666e2e3f14bc8676b969b945ee6e136f","https://www.semanticscholar.org/paper/7509c66a666e2e3f14bc8676b969b945ee6e136f",2,"CAPE: Encoding Relative Positions with Continuous Augmented Positional Embeddings","This paper proposes an augmentation-based approach (CAPE) for absolute positional embeddings, which keeps the advantages of both absolute and relative positions and leads to better generalization performance as well as increased stability with respect to training hyper-parameters.","Neural Information Processing Systems",2021,"T. Likhomanenko,Qiantong Xu,Ronan Collobert,Gabriel Synnaeve,A. Rogozhnikov",16,56,3
"47ae807cd511b35e78a2cd4e198283dea6dafd41","https://www.semanticscholar.org/paper/47ae807cd511b35e78a2cd4e198283dea6dafd41",2,"Do Transformers Really Perform Bad for Graph Representation?","This paper presents Graphormer, which is built upon the standard Transformer architecture, and could attain excellent results on a broad range of graph representation learning tasks, especially on the recent OGB Large-Scale Challenge.","Neural Information Processing Systems",2021,"Chengxuan Ying,Tianle Cai,Shengjie Luo,Shuxin Zheng,Guolin Ke,Di He,Yanming Shen,Tie-Yan Liu",273,63,70
"1dbb523a6555d6e0c5727620e2b57daaa5b79dc0","https://www.semanticscholar.org/paper/1dbb523a6555d6e0c5727620e2b57daaa5b79dc0",2,"Convolutions and Self-Attention: Re-interpreting Relative Positions in Pre-trained Language Models","Composite attention is proposed, which unites previous relative position encoding methods under a convolutional framework, and finds that convolutions consistently improve performance on multiple downstream tasks, replacing absolute position embeddings.","Annual Meeting of the Association for Computational Linguistics",2021,"Tyler A. Chang,Yifan Xu,Weijian Xu,Z. Tu",5,32,1
"8835d7e27472e6041b640c869ce6b94021f8c851","https://www.semanticscholar.org/paper/8835d7e27472e6041b640c869ce6b94021f8c851",2,"Do Large Scale Molecular Language Representations Capture Important Structural Information?","Experiments show that the learned molecular representation, MOLFORMER, performs competitively, when compared to existing graph-based and fingerprint-based supervised learning baselines, on the challenging tasks of predicting properties of QM8 and QM9 molecules.","ArXiv",2021,"Jerret Ross,Brian M. Belgodere,Vijil Chenthamarakshan,Inkit Padhi,Youssef Mroueh,Payel Das",11,73,2
"0d508600d77d8a7e6a655cdb6d139779732f649f","https://www.semanticscholar.org/paper/0d508600d77d8a7e6a655cdb6d139779732f649f",2,"Stable, Fast and Accurate: Kernelized Attention with Relative Positional Encoding","A novel way to accelerate attention calculation for Transformers with RPE on top of the kernelized attention using Fast Fourier Transform (FFT), and it is demonstrated that properly using relative positional encoding can mitigate the training instability problem of vanilla Kernelized attention.","Neural Information Processing Systems",2021,"Shengjie Luo,Shanda Li,Tianle Cai,Di He,Dinglan Peng,Shuxin Zheng,Guolin Ke,Liwei Wang,Tie-Yan Liu",23,53,2
"c6dad3f9c9f29602b8c89585c23c73377ef00601","https://www.semanticscholar.org/paper/c6dad3f9c9f29602b8c89585c23c73377ef00601",2,"Bootstrap Representation Learning for Segmentation on Medical Volumes and Sequences","This work proposed an asymmetric network with an attention-guided predictor to enforce distance-specific prediction and supervision on slices within and across volumes/sequences and introduced a novel prototype-based foreground-background calibration module to enhance representation consistency.","ArXiv",2021,"Zejian Chen,Wei Zhuo,Tianfu Wang,Wufeng Xue,Dong Ni",2,59,2
"fbac64d617914ab8dac0682639fbd6012faed771","https://www.semanticscholar.org/paper/fbac64d617914ab8dac0682639fbd6012faed771",2,"Rethinking Positional Encoding","It is shown that alternative non-Fourier embedding functions can indeed be used for positional encoding and that their performance is entirely determined by a trade-off between the stable rank of the embedded matrix and the distance preservation between embedded coordinates.","ArXiv",2021,"Jianqiao Zheng,Sameera Ramasinghe,S. Lucey",23,38,0
"d3f51870f4da5dd9c2a08a55cfa8a380b8d49208","https://www.semanticscholar.org/paper/d3f51870f4da5dd9c2a08a55cfa8a380b8d49208",2,"Lighter and Better: Low-Rank Decomposed Self-Attention Networks for Next-Item Recommendation","This work introduces the low-rank decomposed self-attention, which projects user's historical items into a small constant number of latent interests and leverages item-to-interest interaction to generate the context-aware representation and designs the decoupled position encoding, which models the sequential relations between items more precisely.","Annual International ACM SIGIR Conference on Research and Development in Information Retrieval",2021,"Xinyan Fan,Zheng Liu,Jianxun Lian,Wayne Xin Zhao,Xing Xie,Ji-Rong Wen",21,18,3
"79678d2f10bddf14b2aedf3427f8a4c39908931f","https://www.semanticscholar.org/paper/79678d2f10bddf14b2aedf3427f8a4c39908931f",2,"Variable-Length Music Score Infilling via XLNet and Musically Specialized Positional Encoding","A new self-attention based model for music score infilling, i.e., to generate a polyphonic music sequence that fills in the gap between given past and future contexts, that can infill a variable number of notes for different time spans is proposed.","International Society for Music Information Retrieval Conference",2021,"Chin-Jui Chang,Chun-Yi Lee,Yi-Hsuan Yang",7,44,0
"ed535e93d5b5a8b689e861e9c6083a806d1535c2","https://www.semanticscholar.org/paper/ed535e93d5b5a8b689e861e9c6083a806d1535c2",2,"The Devil is in the Detail: Simple Tricks Improve Systematic Generalization of Transformers","By revisiting model configurations as basic as scaling of embeddings, early stopping, relative positional embedding, and Universal Transformer variants, this work can drastically improve the performance of Transformers on systematic generalization.","Conference on Empirical Methods in Natural Language Processing",2021,"R. Csordás,Kazuki Irie,J. Schmidhuber",55,55,11
"51b5db5c679be0ce9a39a2ee21def42bca165efe","https://www.semanticscholar.org/paper/51b5db5c679be0ce9a39a2ee21def42bca165efe",2,"Shatter: An Efficient Transformer Encoder with Single-Headed Self-Attention and Relative Sequence Partitioning","An alternative self-attention architecture, Shatter, that more efficiently encodes sequence information by softly partitioning the space of relative positions and applying different value matrices to different parts of the sequence, making the cost of pretraining much more affordable.","ArXiv",2021,"Ran Tian,Joshua Maynez,Ankur P. Parikh",2,42,0
"aec7e7143bfe082752f428fe01e4090dd7fc411c","https://www.semanticscholar.org/paper/aec7e7143bfe082752f428fe01e4090dd7fc411c",2,"Ultra-high Resolution Image Segmentation via Locality-aware Context Fusion and Alternating Local Enhancement","This paper introduces a novel locality-aware context fusion based segmentation model to process local patches, where the relevance between local patch and its various contexts are jointly and complementarily utilized to handle the semantic regions with large variations.","",2021,"Wenxi Liu,Qi Li,Xin Lin,Weixiang Yang,Shengfeng He,Yuanlong Yu",0,73,0
"33c831326bb47b2ba2031fd7213b6918d23eb01e","https://www.semanticscholar.org/paper/33c831326bb47b2ba2031fd7213b6918d23eb01e",2,"The Impact of Positional Encodings on Multilingual Compression","While sinusoidal positional encodings were designed for monolingual applications, they are particularly useful in multilingual language models, because they were explicitly designed to facilitate compositionality by allowing linear projections over arbitrary time steps.","Conference on Empirical Methods in Natural Language Processing",2021,"Vinit Ravishankar,Anders Søgaard",3,20,0
"232acef2483a26fe95c70b619f88fa0b82c1a105","https://www.semanticscholar.org/paper/232acef2483a26fe95c70b619f88fa0b82c1a105",2,"Multiplicative Position-aware Transformer Models for Language Understanding","It is shown that the proposed embedding method, which served as a drop-in replacement of the default absolute position embedding, can improve the RoberTa-base and RoBERTa-large models on SQuAD1.1 and SQuad2.0 datasets.","ArXiv",2021,"Zhiheng Huang,Davis Liang,Peng Xu,Bing Xiang",0,23,0
"87e879c2465b2414a58dd3a1184f8b346d48f3e7","https://www.semanticscholar.org/paper/87e879c2465b2414a58dd3a1184f8b346d48f3e7",2,"Learning to Iteratively Solve Routing Problems with Dual-Aspect Collaborative Transformer","This paper presents a novel Dual-Aspect Collaborative Transformer to learn embeddings for the node and positional features separately, instead of fusing them together as done in existing ones, so as to avoid potential noises and incompatible correlations.","Neural Information Processing Systems",2021,"Yining Ma,Jingwen Li,Zhiguang Cao,Wen Song,Le Zhang,Zhenghua Chen,Jing Tang",28,39,5
"c501d6f1eecf3b0fdae7d428e1829bb6607a6a37","https://www.semanticscholar.org/paper/c501d6f1eecf3b0fdae7d428e1829bb6607a6a37",2,"Relative Molecule Self-Attention Transformer","Relative Molecule Attention Transformer (R-MAT) is identified: a novel Transformer-based model based on the developed self-attention layer that achieves state-of-the-art or very competitive results across a wide range of molecule property prediction tasks.","ArXiv",2021,"Lukasz Maziarka,Dawid Majchrowski,Tomasz Danel,Piotr Gainski,J. Tabor,I. Podolak,Pawel M. Morkisz,Stanislaw Jastrzebski",8,55,2
"91a4cbae6553e975ddc3b2f6850ed725ff475307","https://www.semanticscholar.org/paper/91a4cbae6553e975ddc3b2f6850ed725ff475307",2,"SwinTrack: A Simple and Strong Baseline for Transformer Tracking","This paper proposes a simple yet efﬁcient fully-attentional tracker, dubbed SwinTrack, within classic Siamese framework that leverages the Transformer architecture, enabling better feature interactions for tracking than pure CNN or hybrid CNN-Transformer frameworks.","ArXiv",2021,"Liting Lin,Heng Fan,Yong Xu,Haibin Ling",26,63,7
"9fe29c834afbe1848d9df713ae6e0ca3bd053605","https://www.semanticscholar.org/paper/9fe29c834afbe1848d9df713ae6e0ca3bd053605",2,"Probing the Role of Positional Information in Vision-Language Models","A case study of LXMERT, a state-of-the-art VL model, which probes the use of the PI in the representation and study its effect on Visual Question Answering, it is shown that the model is not capable of leveraging the PI for the image-text matching task on a challenge set where only position differs.","NAACL-HLT",2022,"Philipp J. Rösch,Jindřich Libovický",2,44,0
"08013183713f427258d36332b1bee9d6ce37cf30","https://www.semanticscholar.org/paper/08013183713f427258d36332b1bee9d6ce37cf30",2,"S TRUCTURE -A WARE T RANSFORMER P OLICY FOR I NHOMOGENEOUS M ULTI -T ASK R EINFORCEMENT L EARNING","It is empirically show that the morphological information is crucial for modular reinforcement learning, substantially outperforming prior state-of-the-art methods on multi-task learning as well as transfer learning settings with different state and action space dimensions.","",2022,"Sunghoon Hong,Deunsol Yoon,Kee-Eung Kim",0,34,0
"26ce5dd8221efc307fceef111e003bdb0ffe8ed5","https://www.semanticscholar.org/paper/26ce5dd8221efc307fceef111e003bdb0ffe8ed5",2,"Positional Attention Guided Transformer-like Architecture for Visual Question Answering","A novel positional attention guided Transformer-like architecture which can adaptively extracts positional information within and across the visual and language modalities, and use this information to guide high-level interactions in inter- and intra- modality information flows is proposed.","IEEE transactions on multimedia",2022,"Aihua Mao,Zhi Yang,Ken Lin,Jun-ying Xuan,Yong-Jin Liu",0,51,0
"6aded7d6f93fd93c5632b627b6520830a3999ad4","https://www.semanticscholar.org/paper/6aded7d6f93fd93c5632b627b6520830a3999ad4",2,"Molformer: Large Scale Chemical Language Representations Capture Molecular Structure and Properties","Experiments show that utilizing the learned molecular representation outperforms existing baselines on downstream tasks, including supervised and self-supervised graph neural net baselines and language models, on several classiﬁcation and regression tasks from ten benchmark datasets while performing competitively on two others.","",2022,"Jerret Ross,Brian M. Belgodere,V. Chenthamarakshan,Inkit Padhi,Youssef Mroueh,Payel Das",3,69,1
"2a98fd84fd7a1eadbeb4513ad322d13286ecb9ac","https://www.semanticscholar.org/paper/2a98fd84fd7a1eadbeb4513ad322d13286ecb9ac",2,"Graph Hawkes Transformer for Extrapolated Reasoning on Temporal Knowledge Graphs","A Graph Hawkes Transformer (GHT) is proposed, which combines two variants of Transformer, which capture the instantaneous structural information and temporal evolution information, respectively, and a new relational continuous-time encoding function to facilitate feature evolution with the Hawkes process.","Conference on Empirical Methods in Natural Language Processing",2022,"Haohai Sun,Shangyi Geng,Jialu Zhong,Han Hu,Kun He",0,40,0
"20333c34f892c8e0c2f4e6c37295a8b43ef35c02","https://www.semanticscholar.org/paper/20333c34f892c8e0c2f4e6c37295a8b43ef35c02",2,"Rethinking Positional Encoding in Tree Transformer for Code Representation","This work proposes a novel tree Transformer encoding node positions based on a new description method for tree structures that outperforms strong baselines on code summarization and completion tasks across two languages, demonstrating the model’s effectiveness.","Conference on Empirical Methods in Natural Language Processing",2022,"Han Peng,Ge Li,Yunfei Zhao,Zhi Jin",0,44,0
"7072db6eddb85ecd2c117365d91bd694760f726e","https://www.semanticscholar.org/paper/7072db6eddb85ecd2c117365d91bd694760f726e",2,"Position Information in Transformers: An Overview","An overview and theoretical comparison of existing methods to incorporate position information into Transformer models is provided and what characteristics of an application should be taken into account when selecting a position encoding is indicated.","Computational Linguistics",2021,"Philipp Dufter,Martin Schmitt,Hinrich Schütze",35,67,2
"b8cee43a51c44f8f4448e78e41ecf081987707cf","https://www.semanticscholar.org/paper/b8cee43a51c44f8f4448e78e41ecf081987707cf",2,"Towards Robust Vision Transformer","Robust Vision Transformer (RVT) is proposed, which is a new vision transformer and has superior performance with strong robustness and generalization ability compared with previous ViTs and state-of-the-art CNNs.","Computer Vision and Pattern Recognition",2021,"Xiaofeng Mao,Gege Qi,Yuefeng Chen,Xiaodan Li,Ranjie Duan,Shaokai Ye,Yuan He,Hui Xue",58,53,7
"d8d2e574965fe733eb1416e03df2b5c2914fc530","https://www.semanticscholar.org/paper/d8d2e574965fe733eb1416e03df2b5c2914fc530",2,"A Survey of Transformers","This survey provides a comprehensive review of various Transformer variants and proposes a new taxonomy of X-formers from three perspectives: architectural modification, pre-training, and applications.","AI Open",2021,"Tianyang Lin,Yuxin Wang,Xiangyang Liu,Xipeng Qiu",172,171,5
"df59d0098c1b2c1ee8995da802dd6b12d158c2b8","https://www.semanticscholar.org/paper/df59d0098c1b2c1ee8995da802dd6b12d158c2b8",2,"Large-scale chemical language representations capture molecular structure and properties","Encouraging evidence is provided that large-scale molecular language models can capture sufficient chemical and structural information to predict various distinct molecular properties, including quantum-chemical properties.","Nature Machine Intelligence",2021,"Jerret Ross,Brian M. Belgodere,V. Chenthamarakshan,Inkit Padhi,Youssef Mroueh,Payel Das",1,75,0
"87e823d2cb58e741230c0fa3b83f3459c7e32241","https://www.semanticscholar.org/paper/87e823d2cb58e741230c0fa3b83f3459c7e32241",2,"PiSLTRc: Position-Informed Sign Language Transformer With Content-Aware Convolution","This work proposes a new model architecture, namely PiSLTRc, with two distinctive characteristics: content-aware and position-aware convolution layers, thus generating robust neighborhood-enhanced sign representation and achieves state-of-the-art performance on translation quality with $+1.6$ BLEU improvements.","IEEE transactions on multimedia",2021,"Pan Xie,Mengyi Zhao,Xiaohui Hu",5,52,0
"9ca329408813d209b1dcb36936f7f9cba82506bd","https://www.semanticscholar.org/paper/9ca329408813d209b1dcb36936f7f9cba82506bd",2,"Train Short, Test Long: Attention with Linear Biases Enables Input Length Extrapolation","This work shows that extrapolation can be enabled by simply changing the position representation method, though it finds that current methods do not allow for efficient extrapolation, and introduces a simpler and more efficient position method, Attention with Linear Biases (ALiBi).","International Conference on Learning Representations",2021,"Ofir Press,Noah A. Smith,M. Lewis",67,48,14
"155f8b1907f0ca6bdc3f6a7c7e12ae666cf5d944","https://www.semanticscholar.org/paper/155f8b1907f0ca6bdc3f6a7c7e12ae666cf5d944",2,"Transformers in Time Series: A Survey","This paper systematically review Transformer schemes for time series modeling by highlighting their strengths as well as limitations, and is the first work to comprehensively and systematically summarize the recent advances of Transformers for modeling time series data.","ArXiv",2022,"Qingsong Wen,Tian Zhou,Chao Zhang,Weiqiu Chen,Ziqing Ma,Junchi Yan,Liang Sun",34,89,4
"50af83ea20201b51014358534650213e6133650c","https://www.semanticscholar.org/paper/50af83ea20201b51014358534650213e6133650c",2,"FastRPB: a Scalable Relative Positional Encoding for Long Sequence Tasks","Improved Linear Transformer with Shift-Invariant Kernel Function SIKF and FastRPB1 which stands for Fast Relative Positional Bias, which efficiently adds positional information to self-attention using Fast Fourier Transformation, which significantly outperforms another efficient positional encodings method in accuracy.","ArXiv",2022,"Maksim Zubkov,Daniil Gavrilov",0,23,0
"4e9cd6be4a8fcad2ca562fcf41a1f882387a3167","https://www.semanticscholar.org/paper/4e9cd6be4a8fcad2ca562fcf41a1f882387a3167",2,"LGT-Net: Indoor Panoramic Room Layout Estimation with Geometry-Aware Transformer Network","This work proposes an efficient network, LGT-Net, for room layout estimation, which contains a novel Transformer architecture called SWG-Transformer to model geometry relations, and designs a novel relative position embedding of Transformer to enhance the spatial identification ability for the panorama.","Computer Vision and Pattern Recognition",2022,"Zhigang Jiang,Zhongzheng Xiang,Jinhua Xu,Mingbi Zhao",2,34,1
"838a2297b94f7bad96c4f8370a5f58487f194f44","https://www.semanticscholar.org/paper/838a2297b94f7bad96c4f8370a5f58487f194f44",2,"Visual Abductive Reasoning","A new task and dataset, Visual Abductive Reasoning (VAR), for examining abductive reasoning ability of machine intelligence in everyday visual situations, and devise a strong baseline model, REASONER (causal-and-cascaded reasoning Transformer), which surpasses many famous video-language models, while still being far behind human performance.","Computer Vision and Pattern Recognition",2022,"Chen Liang,Wenguan Wang,Tianfei Zhou,Yi Yang",5,85,0
"2e03ee15c00561a891eaf197515da720d1566411","https://www.semanticscholar.org/paper/2e03ee15c00561a891eaf197515da720d1566411",2,"Causal Transformer for Estimating Counterfactual Outcomes","A novel Causal Transformer for estimating counterfactual outcomes over time that aims to learn adversarial balanced representations, so that they are predictive of the next outcome but non-predictive of the current treatment assignment.","International Conference on Machine Learning",2022,"Valentyn Melnychuk,Dennis Frauen,S. Feuerriegel",12,61,1
"633851a323990270461b49e8068a2c9ca1cea530","https://www.semanticscholar.org/paper/633851a323990270461b49e8068a2c9ca1cea530",2,"Dynamic Position Encoding for Transformers","This paper proposes a novel architecture with new position embeddings that take the order of the target words into consideration and generates new embedDings to refine each word’s position information as dynamic position encoding (DPE).","International Conference on Computational Linguistics",2022,"Joyce Zheng,Mehdi Rezagholizadeh,P. Passban",0,21,0
"2193d898e556ad2ac14f0ababf02f90e6fdfe663","https://www.semanticscholar.org/paper/2193d898e556ad2ac14f0ababf02f90e6fdfe663",2,"DecBERT: Enhancing the Language Understanding of BERT with Causal Attention Masks","This work focuses on improving the position encoding ability of BERT with the causal attention masks, and proposes a new pre-trained language model DecBERT and evaluates it on the GLUE benchmark.","NAACL-HLT",2022,"Ziyang Luo,Yadong Xi,Jing Ma,Zhiwei Yang,Xiao-Xi Mao,Changjie Fan,Rongsheng Zhang",1,54,0
"b9a701c90f3d3df27366f5b29a97f798eb940ac7","https://www.semanticscholar.org/paper/b9a701c90f3d3df27366f5b29a97f798eb940ac7",2,"ChapterBreak: A Challenge Dataset for Long-Range Language Models","This work introduces C HAPTER B REAK, a challenge dataset that provides an LRLM with a long segment from a narrative that ends at a chapter boundary and asks it to distinguish the beginning of the ground-truth next chapter from a set of negative segments sampled from the same narrative.","North American Chapter of the Association for Computational Linguistics",2022,"Simeng Sun,Katherine Thai,Mohit Iyyer",4,39,1
"9d03a164759bb5cc2fa6b575254b58f790ab6785","https://www.semanticscholar.org/paper/9d03a164759bb5cc2fa6b575254b58f790ab6785",2,"Zero-shot Code-Mixed Offensive Span Identification through Rationale Extraction","This paper investigates the effectiveness of sentence-level transformers for zero-shot offensive span identification on a code-mixed Tamil dataset and finds both LIME and IG to show significant improvement with Masked Data Augmentation and Multilabel Training.","DRAVIDIANLANGTECH",2022,"Manikandan Ravikiran,Bharathi Raja Chakravarthi",1,19,0
"6e98a35c439c5c7387de6bffd96dea9b2943a548","https://www.semanticscholar.org/paper/6e98a35c439c5c7387de6bffd96dea9b2943a548",2,"Trading Positional Complexity vs. Deepness in Coordinate Networks","This paper shows that alternative non-Fourier embedding functions can indeed be used for positional encoding, and shows that their performance is entirely determined by a trade-off between the stable rank of the embedded matrix and the distance preservation between embedded coordinates.","European Conference on Computer Vision",2022,"Jianqiao Zheng,Sameera Ramasinghe,Xueqian Li,S. Lucey",0,39,0
"d6c5aab433d9871cabc01ffb1e5e1ea89141155b","https://www.semanticscholar.org/paper/d6c5aab433d9871cabc01ffb1e5e1ea89141155b",2,"KERPLE: Kernelized Relative Positional Embedding for Length Extrapolation","KERPLE, a framework that generalizes relative position embedding for extrapolation by kernelizing positional differences, is proposed using conditionally positive deﬁnite (CPD) kernels, and it is shown that a CPD kernel can be transformed into a PD kernel by adding a constant offset.","ArXiv",2022,"Ta-Chung Chi,Ting-Han Fan,P. Ramadge,Alexander I. Rudnicky",1,54,0
"e1461a3aa9f4bef86435fa2cc87b16d9f34d5ab0","https://www.semanticscholar.org/paper/e1461a3aa9f4bef86435fa2cc87b16d9f34d5ab0",2,"Do we really need temporal convolutions in action segmentation?","A pure Transformer-based model without temporal convolutions by incorporating temporal sampling, called Temporal U-Transformer (TUT), which reduces complexity while introducing an induc- tive bias that adjacent frames are more likely to belong to the same class, but the introduction of coarse resolutions in the misclassiﬁcation of boundaries.","",2022,"Dazhao Du,Bing Su,Yu Li,Zhongang Qi,Lingyu Si,Ying Shan",1,51,0
"3884307cb95329275755baaf99600e7431be695d","https://www.semanticscholar.org/paper/3884307cb95329275755baaf99600e7431be695d",2,"Efficient U-Transformer with Boundary-Aware Loss for Action Segmentation","A pure Transformer-based model without temporal convolution-based models by incorporating the U-Net architecture is designed and a boundary-aware loss based on the distribution of similarity scores between frames from attention modules is proposed to enhance the ability to recognize boundaries.","ArXiv",2022,"Dazhao Du,Bing Su,Yu Li,Zhongang Qi,Lingyu Si,Ying Shan",2,57,0
"746a9b434d05b47beb1bd6a96f4d5c89d9d8bd0a","https://www.semanticscholar.org/paper/746a9b434d05b47beb1bd6a96f4d5c89d9d8bd0a",2,"Your Transformer May Not be as Powerful as You Expect","This work mathematically analyzes the power of RPE-based Transformers regarding whether the model is capable of approximating any continuous sequence-to-sequence functions and develops a novel attention module, called Universal R PE-based (URPE) Attention, which sitsisﬁes the conditions.","ArXiv",2022,"Shengjie Luo,Shanda Li,Shuxin Zheng,Tie-Yan Liu,Liwei Wang,Di He",5,78,1
